joke_id,joke,Processed_joke,cluster,sorted_topics,main_topic
1," A man visits the doctor. The doctor says ""I have bad news for you.You have cancer and Alzheimer's disease"".   The man replies ""Well,thank God I don't have cancer!"" ",man visit doctor doctor say news cancer alzheimer disease man reply god cancer,"[(0, 0.0020770282), (1, 0.0020696681), (2, 0.0026792253), (3, 0.0021191707), (4, 0.97802085), (5, 0.0024921019), (6, 0.0023294687), (7, 0.0029581932), (8, 0.0028903924), (9, 0.002363923)]","[(4, 0.97802085), (7, 0.0029581932), (8, 0.0028903924), (2, 0.0026792253), (5, 0.0024921019), (9, 0.002363923), (6, 0.0023294687), (3, 0.0021191707), (0, 0.0020770282), (1, 0.0020696681)]",4
2," This couple had an excellent relationship going until one day he came home from work to find his girlfriend packing. He asked her why she was leaving him and she told him that she had heard awful things about him.    ""What could they possibly have said to make you move out?""    ""They told me that you were a pedophile.""    He replied, ""That's an awfully big word for a ten year old.""  ",excellent relationship going day came home work find packing asked leaving heard thing could said make move told pedophile replied word year,"[(0, 0.0012401268), (1, 0.0012357323), (2, 0.0015996794), (3, 0.9862362), (4, 0.0019060139), (5, 0.0014879539), (6, 0.0013908509), (7, 0.0017662421), (8, 0.0017257604), (9, 0.0014114224)]","[(3, 0.9862362), (4, 0.0019060139), (7, 0.0017662421), (8, 0.0017257604), (2, 0.0015996794), (5, 0.0014879539), (9, 0.0014114224), (6, 0.0013908509), (0, 0.0012401268), (1, 0.0012357323)]",3
3, Q. What's 200 feet long and has 4 teeth?    A. The front row at a Willie Nelson Concert. ,foot teeth row nelson concert,"[(0, 0.0051912805), (1, 0.005172885), (2, 0.0066963998), (3, 0.0052966108), (4, 0.007978743), (5, 0.0062287073), (6, 0.005822225), (7, 0.0073936456), (8, 0.007224186), (9, 0.94299525)]","[(9, 0.94299525), (4, 0.007978743), (7, 0.0073936456), (8, 0.007224186), (2, 0.0066963998), (5, 0.0062287073), (6, 0.005822225), (3, 0.0052966108), (0, 0.0051912805), (1, 0.005172885)]",9
4, Q. What's the difference between a man and a toilet?    A. A toilet doesn't follow you around after you use it. ,difference man toilet toilet doesn follow use,"[(0, 0.003775904), (1, 0.0037625239), (2, 0.0048706597), (3, 0.0038525164), (4, 0.0058033788), (5, 0.0045304815), (6, 0.0042348243), (7, 0.95961773), (8, 0.0052545476), (9, 0.00429746)]","[(7, 0.95961773), (4, 0.0058033788), (8, 0.0052545476), (2, 0.0048706597), (5, 0.0045304815), (9, 0.00429746), (6, 0.0042348243), (3, 0.0038525164), (0, 0.003775904), (1, 0.0037625239)]",7
5," Q.	What's O. J. Simpson's Internet address?   A.	Slash, slash, backslash, slash, slash, escape. ",internet address slash slash backslash slash slash escape,"[(0, 0.003322909), (1, 0.003311134), (2, 0.004286327), (3, 0.0033903301), (4, 0.0051071476), (5, 0.9637167), (6, 0.0037267727), (7, 0.00473263), (8, 0.00462416), (9, 0.0037818938)]","[(5, 0.9637167), (4, 0.0051071476), (7, 0.00473263), (8, 0.00462416), (2, 0.004286327), (9, 0.0037818938), (6, 0.0037267727), (3, 0.0033903301), (0, 0.003322909), (1, 0.003311134)]",5
6," Bill & Hillary are on a trip back to Arkansas. They're almost out of gas, so Bill pulls into a service station on the outskirts of town. The attendant runs out of the station to serve them when Hillary realizes it's an old boyfriend from high school. She and the attendant chat as he gases up their car and cleans the windows. Then they all say good-bye.    As Bill pulls the car onto the road, he turns to Hillary and says, 'Now aren't you glad you married me and not him ? You could've been the wife of a grease monkey !'    To which Hillary replied, 'No, Bill. If I would have married him, you'd be pumping gas and he would be the President !'  ",bill trip arkansas re gas bill service station town run station serve realizes boyfriend school attendant gas car window say bye bill pull car road turn say aren glad married could ve wife grease replied bill would married pumping gas would president,"[(0, 0.0006542655), (1, 0.00065194705), (2, 0.00084395806), (3, 0.99273854), (4, 0.0010055739), (5, 0.000785014), (6, 0.0007337844), (7, 0.0009318331), (8, 0.00091047585), (9, 0.0007446375)]","[(3, 0.99273854), (4, 0.0010055739), (7, 0.0009318331), (8, 0.00091047585), (2, 0.00084395806), (5, 0.000785014), (9, 0.0007446375), (6, 0.0007337844), (0, 0.0006542655), (1, 0.00065194705)]",3
7, How many feminists does it take to screw in a light bulb?  That's not funny. ,take bulb funny,"[(0, 0.008303656), (1, 0.008274232), (2, 0.91007936), (3, 0.008472136), (4, 0.012762311), (5, 0.009963061), (6, 0.0093128765), (7, 0.011826425), (8, 0.011555367), (9, 0.009450619)]","[(2, 0.91007936), (4, 0.012762311), (7, 0.011826425), (8, 0.011555367), (5, 0.009963061), (9, 0.009450619), (6, 0.0093128765), (3, 0.008472136), (0, 0.008303656), (1, 0.008274232)]",2
8, Q. Did you hear about the dyslexic devil worshiper?    A. He sold his soul to Santa. ,hear devil sold soul santa,"[(0, 0.005191281), (1, 0.0051728855), (2, 0.0066964), (3, 0.005296611), (4, 0.007978744), (5, 0.0062287077), (6, 0.0058222255), (7, 0.0073936465), (8, 0.007224187), (9, 0.94299525)]","[(9, 0.94299525), (4, 0.007978744), (7, 0.0073936465), (8, 0.007224187), (2, 0.0066964), (5, 0.0062287077), (6, 0.0058222255), (3, 0.005296611), (0, 0.005191281), (1, 0.0051728855)]",9
9," A country guy goes into a city bar that has a dress code, and the maitre d'  demands he wear a tie. Discouraged, the guy goes to his car to sulk when  inspiration strikes: He's got jumper cables in the trunk! So he wraps them around his neck, sort of like a string tie (a bulky string tie to be sure) and returns to the bar. The maitre d' is reluctant, but says to the guy, ""Okay, you're a pretty resourceful fellow, you can come in... but just don't start anything""!   ",country guy go city bar dress code maitre demand discouraged guy go car sulk inspiration strike got cable trunk wrap sort string bulky string return bar maitre say re come start anything,"[(0, 0.9904754), (1, 0.0008535671), (2, 0.001104959), (3, 0.0008739828), (4, 0.0013165559), (5, 0.001027786), (6, 0.0009607133), (7, 0.0012200102), (8, 0.001192048), (9, 0.0009749228)]","[(0, 0.9904754), (4, 0.0013165559), (7, 0.0012200102), (8, 0.001192048), (2, 0.001104959), (5, 0.001027786), (9, 0.0009749228), (6, 0.0009607133), (3, 0.0008739828), (1, 0.0008535671)]",0
10," Two cannibals are eating a clown, one turns to other and says:   ""Does this taste funny to you?    ",eating turn say taste funny,"[(0, 0.0051912162), (1, 0.0051728208), (2, 0.94378406), (3, 0.005296545), (4, 0.007978644), (5, 0.00622863), (6, 0.005822153), (7, 0.007393554), (8, 0.007224096), (9, 0.0059082657)]","[(2, 0.94378406), (4, 0.007978644), (7, 0.007393554), (8, 0.007224096), (5, 0.00622863), (9, 0.0059082657), (6, 0.005822153), (3, 0.005296545), (0, 0.0051912162), (1, 0.0051728208)]",2
11," Q. What do a hurricane, a tornado, and a redneck divorce all have in common?   A. Someone's going to lose their trailer... ",hurricane tornado redneck divorce someone going trailer,"[(0, 0.003775945), (1, 0.0037625646), (2, 0.0048707128), (3, 0.003852558), (4, 0.0058034416), (5, 0.0045305304), (6, 0.9584743), (7, 0.0053778635), (8, 0.005254605), (9, 0.0042975065)]","[(6, 0.9584743), (4, 0.0058034416), (7, 0.0053778635), (8, 0.005254605), (2, 0.0048707128), (5, 0.0045305304), (9, 0.0042975065), (3, 0.003852558), (0, 0.003775945), (1, 0.0037625646)]",6
12," A guy stood over his tee shot for what seemed an eternity, looking up, looking down, measuring the distance, figuring the wind direction and speed. Driving his partner nuts.   Finally his exasperated partner says, ""What the hell is taking so long? Hit the goddamn ball!"" The guy answers, ""My wife is up there watching me from the clubhouse. I want to make this a perfect shot."" ""Well, hell, man, you don't stand a snowball's chance in hell of hitting her from here!""  ",guy stood tee shot seemed eternity looking looking measuring distance figuring direction speed driving partner nut exasperated partner say hell taking hit goddamn ball guy answer wife watching clubhouse want make perfect shot man stand chance hell hitting,"[(0, 0.00072255544), (1, 0.000719995), (2, 0.00093204743), (3, 0.0007372159), (4, 0.0011105322), (5, 0.0008669511), (6, 0.0008103743), (7, 0.0010290946), (8, 0.9922489), (9, 0.00082236016)]","[(8, 0.9922489), (4, 0.0011105322), (7, 0.0010290946), (2, 0.00093204743), (5, 0.0008669511), (9, 0.00082236016), (6, 0.0008103743), (3, 0.0007372159), (0, 0.00072255544), (1, 0.000719995)]",8
13," They asked the Japanese visitor if they have elections in his country.     ""Every Morning"" he answers. ",asked visitor election country morning answer,"[(0, 0.004371886), (1, 0.004356394), (2, 0.9526566), (3, 0.004460591), (4, 0.0067193736), (5, 0.0052455645), (6, 0.0049032415), (7, 0.0062266286), (8, 0.0060839164), (9, 0.0049757636)]","[(2, 0.9526566), (4, 0.0067193736), (7, 0.0062266286), (8, 0.0060839164), (5, 0.0052455645), (9, 0.0049757636), (6, 0.0049032415), (3, 0.004460591), (0, 0.004371886), (1, 0.004356394)]",2
14," The father was very anxious to marry off his only daughter so he wanted  to impress her date. ""Do  you like to screw,"" he says. ""Huh"" replied the  surprised first date. ""My daughter she loves to screw and she's good at it,  you and her  should go screw,"" carefully explained the father. Now very  interested the boy replied, ""Yes, sir."" Minutes later the girl came down  the stairs, kissed her father goodbye and the couple left. After only a  few minutes she reappeared, furious, dress torn, hair a mess and screamed ""Dammit, Daddy, it's the TWIST, get it straight!""  ",marry daughter wanted date screw say huh replied date daughter love screw go screw explained boy replied sir minute came stair kissed couple left minute reappeared dress hair mess screamed dammit daddy twist get straight,"[(0, 0.0007838837), (1, 0.00078110595), (2, 0.0010111567), (3, 0.0007997885), (4, 0.0012047907), (5, 0.00094053516), (6, 0.00087915635), (7, 0.9916166), (8, 0.0010908525), (9, 0.0008921596)]","[(7, 0.9916166), (4, 0.0012047907), (8, 0.0010908525), (2, 0.0010111567), (5, 0.00094053516), (9, 0.0008921596), (6, 0.00087915635), (3, 0.0007997885), (0, 0.0007838837), (1, 0.00078110595)]",7
15, Q:  What did the blind person say when given some matzah?    A:  Who the hell wrote this? ,person say given matzah hell wrote,"[(0, 0.004371936), (1, 0.004356444), (2, 0.0056395005), (3, 0.0044606416), (4, 0.95373607), (5, 0.0052456246), (6, 0.004903298), (7, 0.0062267), (8, 0.006083986), (9, 0.0049758204)]","[(4, 0.95373607), (7, 0.0062267), (8, 0.006083986), (2, 0.0056395005), (5, 0.0052456246), (9, 0.0049758204), (6, 0.004903298), (3, 0.0044606416), (0, 0.004371936), (1, 0.004356444)]",4
16, Q. What is orange and sounds like a parrot?      A. A carrot. ,orange sound parrot carrot,"[(0, 0.006388653), (1, 0.006366015), (2, 0.008240929), (3, 0.006518278), (4, 0.009819046), (5, 0.0076653627), (6, 0.9297412), (7, 0.0090989955), (8, 0.008890449), (9, 0.0072711017)]","[(6, 0.9297412), (4, 0.009819046), (7, 0.0090989955), (8, 0.008890449), (2, 0.008240929), (5, 0.0076653627), (9, 0.0072711017), (3, 0.006518278), (0, 0.006388653), (1, 0.006366015)]",6
17, How many men does it take to screw in a light bulb?    One...men will screw anything.  ,men take screw light bulb men screw anything,"[(0, 0.0033228789), (1, 0.0033111041), (2, 0.96401644), (3, 0.0033902994), (4, 0.0051071015), (5, 0.0039869235), (6, 0.003726739), (7, 0.0047325874), (8, 0.004624118), (9, 0.0037818595)]","[(2, 0.96401644), (4, 0.0051071015), (7, 0.0047325874), (8, 0.004624118), (5, 0.0039869235), (9, 0.0037818595), (6, 0.003726739), (3, 0.0033902994), (0, 0.0033228789), (1, 0.0033111041)]",2
18," A dog walks into Western Union and asks the clerk to send a telegram. He fills out a form on which he writes down the telegram he wishes to send: ""Bow wow wow, Bow wow wow.""   The clerk says, ""You can add another 'Bow wow' for the same price.""   The dog responded, ""Now wouldn't that sound a little silly?""  ",dog walk union asks send telegram fill form writes send bow wow wow bow wow wow clerk say bow wow price dog responded,"[(0, 0.0011869575), (1, 0.0011827515), (2, 0.9871464), (3, 0.0012110407), (4, 0.0018242953), (5, 0.0014241593), (6, 0.0013312194), (7, 0.001690516), (8, 0.00165177), (9, 0.0013509089)]","[(2, 0.9871464), (4, 0.0018242953), (7, 0.001690516), (8, 0.00165177), (5, 0.0014241593), (9, 0.0013509089), (6, 0.0013312194), (3, 0.0012110407), (0, 0.0011869575), (1, 0.0011827515)]",2
19," Q: If a person who speaks three languages is called ""tri-lingual,"" and a person who speaks two languages is called ""bi-lingual,"" what do call a person who only speaks one language?   A: American!  ",person speaks language called person speaks language called call person speaks language,"[(0, 0.0022453684), (1, 0.002237412), (2, 0.002896373), (3, 0.0022909266), (4, 0.003451021), (5, 0.0026940834), (6, 0.9753067), (7, 0.0031979505), (8, 0.0031246545), (9, 0.0025555156)]","[(6, 0.9753067), (4, 0.003451021), (7, 0.0031979505), (8, 0.0031246545), (2, 0.002896373), (5, 0.0026940834), (9, 0.0025555156), (3, 0.0022909266), (0, 0.0022453684), (1, 0.002237412)]",6
20, What's the difference between a MacIntosh and an Etch-A-Sketch?    You don't have to shake the Mac to clear the screen.  ,difference macintosh etch sketch shake mac screen,"[(0, 0.0037759482), (1, 0.0037625679), (2, 0.0048707165), (3, 0.0038525613), (4, 0.0058034468), (5, 0.95876986), (6, 0.004234874), (7, 0.005377868), (8, 0.005254609), (9, 0.0042975103)]","[(5, 0.95876986), (4, 0.0058034468), (7, 0.005377868), (8, 0.005254609), (2, 0.0048707165), (9, 0.0042975103), (6, 0.004234874), (3, 0.0038525613), (0, 0.0037759482), (1, 0.0037625679)]",5
21," What's the difference between a used tire and 365 used condoms?   One's a Goodyear, the other's a great year. ",difference used tire used condom goodyear year,"[(0, 0.0037758641), (1, 0.0037624843), (2, 0.959111), (3, 0.0038524757), (4, 0.0058033178), (5, 0.0045304336), (6, 0.00423478), (7, 0.0053777485), (8, 0.0052544926), (9, 0.004297415)]","[(2, 0.959111), (4, 0.0058033178), (7, 0.0053777485), (8, 0.0052544926), (5, 0.0045304336), (9, 0.004297415), (6, 0.00423478), (3, 0.0038524757), (0, 0.0037758641), (1, 0.0037624843)]",2
22," A duck walks into a pharmacy and asks for a condom. The pharmacist says ""Would you like me to stick that on your bill?"" The duck says:   ""What kind of duck do you think I am!"" ",duck walk pharmacy asks pharmacist say would like bill duck say kind duck think,"[(0, 0.0019321714), (1, 0.0019253247), (2, 0.0024923699), (3, 0.0019713747), (4, 0.0029696524), (5, 0.002318297), (6, 0.002167006), (7, 0.9793359), (8, 0.0026888098), (9, 0.0021990575)]","[(7, 0.9793359), (4, 0.0029696524), (8, 0.0026888098), (2, 0.0024923699), (5, 0.002318297), (9, 0.0021990575), (6, 0.002167006), (3, 0.0019713747), (0, 0.0019321714), (1, 0.0019253247)]",7
23, Q: What is the Australian word for a boomerang that won't    come back?    A: A stick ,word boomerang won come stick,"[(0, 0.0051913466), (1, 0.0051729507), (2, 0.0066964845), (3, 0.005296678), (4, 0.007978844), (5, 0.0062287864), (6, 0.005822299), (7, 0.94447994), (8, 0.0072242776), (9, 0.0059084143)]","[(7, 0.94447994), (4, 0.007978844), (8, 0.0072242776), (2, 0.0066964845), (5, 0.0062287864), (9, 0.0059084143), (6, 0.005822299), (3, 0.005296678), (0, 0.0051913466), (1, 0.0051729507)]",7
24, What do you get when you run over a parakeet with a lawnmower?   Shredded tweet. ,get run tweet,"[(0, 0.008303796), (1, 0.008274372), (2, 0.9100778), (3, 0.008472279), (4, 0.012762527), (5, 0.009963228), (6, 0.009313034), (7, 0.011826625), (8, 0.011555563), (9, 0.009450778)]","[(2, 0.9100778), (4, 0.012762527), (7, 0.011826625), (8, 0.011555563), (5, 0.009963228), (9, 0.009450778), (6, 0.009313034), (3, 0.008472279), (0, 0.008303796), (1, 0.008274372)]",2
25," Two kindergarten girls were talking outside: one said, ""You won't believe what I saw on the patio yesterday--a condom!""   The second girl asked, ""What's a patio?"" ",girl talking said won believe saw patio yesterday condom girl asked patio,"[(0, 0.0022454641), (1, 0.0022375071), (2, 0.0028964963), (3, 0.0022910242), (4, 0.0034511678), (5, 0.0026941982), (6, 0.002518376), (7, 0.0031980867), (8, 0.97591203), (9, 0.0025556243)]","[(8, 0.97591203), (4, 0.0034511678), (7, 0.0031980867), (2, 0.0028964963), (5, 0.0026941982), (9, 0.0025556243), (6, 0.002518376), (3, 0.0022910242), (0, 0.0022454641), (1, 0.0022375071)]",8
26," A guy walks into a bar and sits down next to an extremely gorgeous  woman.  The first thing he notices about her though, are her pants.   They were skin-tight, high-waisted and had no obvious mechanism  (zipper, buttons or velcro) for opening them.    After several minutes of puzzling over how she got the pants up over  her hips, he finally worked up the nerve to ask her.  ""Excuse me miss,  but how do you get into your pants?""    ""Well,"" she replied, ""you can start by buying me a drink."" ",guy walk bar sits woman thing notice skin waisted mechanism button velcro opening minute puzzling got hip worked ask excuse miss get start buying drink,"[(0, 0.0010932988), (1, 0.0010894246), (2, 0.0014102812), (3, 0.0011154816), (4, 0.0016803464), (5, 0.0013117838), (6, 0.0012261774), (7, 0.9883074), (8, 0.0015214345), (9, 0.0012443133)]","[(7, 0.9883074), (4, 0.0016803464), (8, 0.0015214345), (2, 0.0014102812), (5, 0.0013117838), (9, 0.0012443133), (6, 0.0012261774), (3, 0.0011154816), (0, 0.0010932988), (1, 0.0010894246)]",7
27," Clinton returns from a vacation in Arkansas and walks down  the steps of Air Force One with two pigs under his arms.  At the bottom of the steps, he says  to the honor guardsman, ""These are genuine Arkansas Razor-Back Hogs.  I got this one for Chelsea and this one for Hillary.""     The guardsman replies, ""Nice trade, Sir."" ",clinton return vacation arkansas walk step air force pig arm step say arkansas razor hog got chelsea guardsman reply trade sir,"[(0, 0.0012982757), (1, 0.0012936752), (2, 0.0016746875), (3, 0.0013246174), (4, 0.0019953859), (5, 0.0015577234), (6, 0.0014560672), (7, 0.0018490602), (8, 0.9860729), (9, 0.0014776032)]","[(8, 0.9860729), (4, 0.0019953859), (7, 0.0018490602), (2, 0.0016746875), (5, 0.0015577234), (9, 0.0014776032), (6, 0.0014560672), (3, 0.0013246174), (0, 0.0012982757), (1, 0.0012936752)]",8
28," A mechanical, electrical and a software engineer from Microsoft were driving through the desert when the car broke down. The mechanical engineer said ""It seems to be a problem with the fuel injection system, why don't we pop the hood and I'll take a look at it."" To which the electrical engineer replied, ""No I think it's just a loose ground wire, I'll get out and take a look."" Then, the Microsoft engineer jumps in. ""No, no, no. If we just close up all the windows, get out, wait a few minutes, get back in, and then reopen the windows everything will work fine."" ",software engineer microsoft driving desert car broke engineer said seems problem fuel injection system pop hood ll take look engineer replied think ground wire ll get take look engineer jump get wait minute get window everything work fine,"[(0, 0.0007225247), (1, 0.99196374), (2, 0.00093200785), (3, 0.0007371846), (4, 0.0011104849), (5, 0.0008669142), (6, 0.0008103398), (7, 0.0010290509), (8, 0.0010054654), (9, 0.00082232524)]","[(1, 0.99196374), (4, 0.0011104849), (7, 0.0010290509), (8, 0.0010054654), (2, 0.00093200785), (5, 0.0008669142), (9, 0.00082232524), (6, 0.0008103398), (3, 0.0007371846), (0, 0.0007225247)]",1
29," An old Scotsmen is sitting with a younger Scottish gentleman and says the boy.  ""Ah, lad look out that window. You see that stone wall there, I built it with me own bare hands, placed every stone meself.  But do they call me MacGregor the wall builder? No!    He Takes a few sips of his beer then says, ""Aye, and look out on that lake and  eye that beautiful pier. I built it meself, laid every board and hammered each nail but do they call me MacGregor the pier builder? No!    He continues...""And lad, you see that road? That too I build with me own bare  hands. Laid every inch of pavement meself, but do they call MacGregor the road builder? No!""  Again he returns to his beer for a few sips, then says,  ""Agh, but you screw one sheep..."" ",scotsman sitting gentleman say ah look see stone wall built hand placed stone call builder take beer say look eye beautiful pier built laid board hammered call macgregor pier builder continues see road build hand laid inch pavement call road builder return beer sip say screw sheep,"[(0, 0.0005851514), (1, 0.0005830779), (2, 0.00075480563), (3, 0.00059702405), (4, 0.000899349), (5, 0.00070208823), (6, 0.99356484), (7, 0.0008333979), (8, 0.0008142967), (9, 0.0006659769)]","[(6, 0.99356484), (4, 0.000899349), (7, 0.0008333979), (8, 0.0008142967), (2, 0.00075480563), (5, 0.00070208823), (9, 0.0006659769), (3, 0.00059702405), (0, 0.0005851514), (1, 0.0005830779)]",6
30, Q: What's the difference between a Lawyer and a Plumber?    A: A Plumber works to unclog the system. ,difference lawyer plumber work unclog system,"[(0, 0.004371895), (1, 0.0043564034), (2, 0.005639448), (3, 0.0044606), (4, 0.006719388), (5, 0.95226264), (6, 0.0049032522), (7, 0.0062266416), (8, 0.006083929), (9, 0.004975774)]","[(5, 0.95226264), (4, 0.006719388), (7, 0.0062266416), (8, 0.006083929), (2, 0.005639448), (9, 0.004975774), (6, 0.0049032522), (3, 0.0044606), (0, 0.004371895), (1, 0.0043564034)]",5
31,"  President Clinton looks up from his desk in the Oval Office to see  one of his aides nervously approach him.     ""What is it?"" exclaims the President.    ""It's this Abortion Bill Mr. President, what do you want to do  about it?"" the aide replies.    ""Just go ahead and pay it."" responds the President.  ",president clinton look desk office see aide approach president abortion bill mr president want aide reply go pay responds president,"[(0, 0.0013620753), (1, 0.0013572488), (2, 0.0017569847), (3, 0.0013897116), (4, 0.002093443), (5, 0.98512733), (6, 0.001527621), (7, 0.0019399264), (8, 0.001895464), (9, 0.0015502154)]","[(5, 0.98512733), (4, 0.002093443), (7, 0.0019399264), (8, 0.001895464), (2, 0.0017569847), (9, 0.0015502154), (6, 0.001527621), (3, 0.0013897116), (0, 0.0013620753), (1, 0.0013572488)]",5
32," A man arrives at the gates of heaven. St. Peter asks, ""Religion?""  The man says, ""Methodist."" St. Peter looks down his list, and says,  ""Go to room 24, but be very quiet as you pass room 8.""    Another man arrives at the gates of heaven. ""Religion?"" ""Baptist."" ""Go to room 18, but be very quiet as you pass room 8.""    A third man arrives at the gates. ""Religion?"" ""Jewish."" ""Go to room 11, but be very quiet as you pass room 8.""  The man says, ""I can understand there being different rooms for different religions, but why must I be quiet when I pass room 8?"" St. Peter tells him, ""Well the Catholics are in room 8,  and they think they're the only ones here. ",man arrives heaven st peter asks religion man say methodist st peter look list say go room pas room man arrives religion baptist go room pas room man arrives religion jewish go room pas room man say room religion must quiet room peter tell room think re,"[(0, 0.000585145), (1, 0.00058307155), (2, 0.00075479737), (3, 0.0005970175), (4, 0.00089933915), (5, 0.0007020805), (6, 0.9935649), (7, 0.00083338877), (8, 0.0008142878), (9, 0.0006659696)]","[(6, 0.9935649), (4, 0.00089933915), (7, 0.00083338877), (8, 0.0008142878), (2, 0.00075479737), (5, 0.0007020805), (9, 0.0006659696), (3, 0.0005970175), (0, 0.000585145), (1, 0.00058307155)]",6
33," What do you call an American in the finals of the world cup?   ""Hey Beer Man!"" ",world cup hey beer man,"[(0, 0.005191224), (1, 0.0051728287), (2, 0.0066963267), (3, 0.005296553), (4, 0.007978656), (5, 0.0062286393), (6, 0.94290984), (7, 0.007393565), (8, 0.007224107), (9, 0.0059082746)]","[(6, 0.94290984), (4, 0.007978656), (7, 0.007393565), (8, 0.007224107), (2, 0.0066963267), (5, 0.0062286393), (9, 0.0059082746), (3, 0.005296553), (0, 0.005191224), (1, 0.0051728287)]",6
34," Out in the backwoods of some midwestern state, little Johnny arrives at school an hour late.   Teacher: ""Why are you so late, John?""  Johny : ""My big brother got shot in the ass.""  (the teacher corrects his speech)  Teacher: ""Rectum.""  Johnny : ""Wrecked him!? Hell, It damn near killed him!""  ",backwoods state arrives school hour teacher john johny brother got teacher corrects speech johnny wrecked hell damn killed,"[(0, 0.0015107035), (1, 0.0015053502), (2, 0.0019487048), (3, 0.0015413554), (4, 0.002321877), (5, 0.0018126027), (6, 0.0016943133), (7, 0.002151609), (8, 0.9837941), (9, 0.0017193732)]","[(8, 0.9837941), (4, 0.002321877), (7, 0.002151609), (2, 0.0019487048), (5, 0.0018126027), (9, 0.0017193732), (6, 0.0016943133), (3, 0.0015413554), (0, 0.0015107035), (1, 0.0015053502)]",8
