joke_id,joke,Processed_joke,cluster,sorted_topics,main_topic
91,"A Panda bear walks into a bar.  Sits down at a table and orders a beer and a double cheeseburger.  After he is finished eating, he pulls out a gunand rips the place with gunfire.  Patrons scatter and dive under chairs andtables as the bear runs out the door.  After ensuring that no one is hurt, the bartender races out the door, and calls after the bear ""What the hell didyou do that for?""  The bear calls back, ""I'm a Panda bear.  Look it up in thedictionary.""  The bartender returns, pulls out his dictionary.panda : \Pan""da\, n. (Zo[""o]l.)A small Asiatic mammal (Ailurus fulgens) having fine soft fur.It is related to the bears, and inhabits the mountains of Northern India.Eats shoots and leaves.",panda bear walk bar sits order beer cheeseburger finished eating pull gunand rip place gunfire patron scatter chair andtables bear run ensuring hurt bartender race door call bear hell didyou call panda look bartender return pull panda pan da zo ailurus fulgens fur related inhabits mountain india eats shoot leaf,"[(0, 0.0006765114), (1, 0.0005754611), (2, 0.00057444535), (3, 0.00066887116), (4, 0.0007819281), (5, 0.0006602419), (6, 0.00071104435), (7, 0.00076065585), (8, 0.0005745697), (9, 0.9940163)]","[(9, 0.9940163), (4, 0.0007819281), (7, 0.00076065585), (6, 0.00071104435), (0, 0.0006765114), (3, 0.00066887116), (5, 0.0006602419), (1, 0.0005754611), (8, 0.0005745697), (2, 0.00057444535)]",9
92,"Early one morning a mother went to her sleeping son and woke him up.""Wake up, son.  It's time to go to school."" ""But why, Mama?  I don't want to go to school."" ""Give me two reasons why you don't want to go to school."" ""One, all the children hate me. Two, all the teachers hate me,"" ""Oh! that's no reason. Come on, you have to go to school,"" ""Give me two good reasons WHY I should go to school?""  ""One, you are fifty-two years old. Two, you are the principal of the school."" ",morning mother went sleeping son woke wake son time go school mama want go school give reason want go school child hate teacher hate reason come go school reason go school fifty year school,"[(0, 0.0009917602), (1, 0.00084362127), (2, 0.0008421322), (3, 0.99124944), (4, 0.0011463001), (5, 0.0009679092), (6, 0.0010423852), (7, 0.0011151154), (8, 0.0008423145), (9, 0.00095897884)]","[(3, 0.99124944), (4, 0.0011463001), (7, 0.0011151154), (6, 0.0010423852), (0, 0.0009917602), (5, 0.0009679092), (9, 0.00095897884), (1, 0.00084362127), (8, 0.0008423145), (2, 0.0008421322)]",3
93,"Reaching the end of a job interview, the human resources person asked ayoung engineer fresh out of Stanford,""And what starting salary were you looking for?""The engineer said, ""In the neighborhood of $125,000 a year, dependingon the benefits package.""The interviewer said, ""Well, what would you say to a package of 5-weeks vacation, 14 paid holidays, full medical and dental, company matching retirement fund to 50% of salary, and a company car leased every 2 years - say, a red Corvette?""The Engineer sat up straight and said, ""Wow! Are you kidding?""And the interviewer replied, ""Yeah, but you started it.""",reaching end job interview resource person asked engineer stanford starting looking engineer said year dependingon benefit package interviewer said would say package week vacation paid holiday company matching retirement fund company car leased year say corvette engineer sat said kidding interviewer replied yeah started,"[(0, 0.0007680663), (1, 0.00065334054), (2, 0.00065218733), (3, 0.00075939216), (4, 0.0008877495), (5, 0.99321336), (6, 0.00080727285), (7, 0.0008635984), (8, 0.0006523285), (9, 0.00074267894)]","[(5, 0.99321336), (4, 0.0008877495), (7, 0.0008635984), (6, 0.00080727285), (0, 0.0007680663), (3, 0.00075939216), (9, 0.00074267894), (1, 0.00065334054), (8, 0.0006523285), (2, 0.00065218733)]",5
94,"Two atoms are walking down the street when one atom says to the other ""Oh, my! I've lost an electron!""The second atom says""Are you sure""The first replies ""I'm positive!""",walking street atom say ve lost atom say reply,"[(0, 0.0036480401), (1, 0.9673089), (2, 0.0030976564), (3, 0.003606841), (4, 0.004216492), (5, 0.003560308), (6, 0.003834257), (7, 0.0041017835), (8, 0.0030983267), (9, 0.003527459)]","[(1, 0.9673089), (4, 0.004216492), (7, 0.0041017835), (6, 0.003834257), (0, 0.0036480401), (3, 0.003606841), (5, 0.003560308), (9, 0.003527459), (8, 0.0030983267), (2, 0.0030976564)]",1
95,"Just a thought ..Before criticizing someone, walk a mile in their shoes.  Then when you do criticize them, you will be a mile away and have their shoes !",thought criticizing someone walk shoe criticize mile shoe,"[(0, 0.004085853), (1, 0.0034755508), (2, 0.0034694162), (3, 0.0040397095), (4, 0.9646324), (5, 0.003987592), (6, 0.0042944187), (7, 0.0045940517), (8, 0.003470167), (9, 0.0039508007)]","[(4, 0.9646324), (7, 0.0045940517), (6, 0.0042944187), (0, 0.004085853), (3, 0.0040397095), (5, 0.003987592), (9, 0.0039508007), (1, 0.0034755508), (8, 0.003470167), (2, 0.0034694162)]",4
96,"Two attorneys went into a diner and ordered two drinks.  Then they produced sandwiches from their briefcases and started to eat.  The owner becamequite concerned and marched over and told them, ""You can't eat your ownsandwiches in here!""The attorneys looked at each other, shrugged their shoulders and thenexchanged sandwiches.",attorney went ordered drink produced briefcase started eat owner becamequite concerned marched eat ownsandwiches attorney looked shoulder thenexchanged sandwich,"[(0, 0.98448), (1, 0.0014981685), (2, 0.0014955241), (3, 0.0017413544), (4, 0.0020356893), (5, 0.0017188886), (6, 0.0018511491), (7, 0.0019803087), (8, 0.0014958478), (9, 0.0017030295)]","[(0, 0.98448), (4, 0.0020356893), (7, 0.0019803087), (6, 0.0018511491), (3, 0.0017413544), (5, 0.0017188886), (9, 0.0017030295), (1, 0.0014981685), (8, 0.0014958478), (2, 0.0014955241)]",0
97,"A teacher is explaining to her class how different languages use negatives differently.  She says, ""In all languages, a positive followedby a negative or a negative followed by a positive makes a negative.  Insome languages, two negatives together make a positive, while in others theymake a negative.  But in no language do two positives make a negative.""  One of the students puts up his hand and says, ""Yeah, right.""",explaining class language use say language followed make language make others theymake language make student put hand say,"[(0, 0.0018572701), (1, 0.0015798503), (2, 0.0015770618), (3, 0.0018362951), (4, 0.0021466773), (5, 0.98358923), (6, 0.0019520759), (7, 0.0020882776), (8, 0.0015774032), (9, 0.0017958806)]","[(5, 0.98358923), (4, 0.0021466773), (7, 0.0020882776), (6, 0.0019520759), (0, 0.0018572701), (3, 0.0018362951), (9, 0.0017958806), (1, 0.0015798503), (8, 0.0015774032), (2, 0.0015770618)]",5
98,"Age and Womanhood1. Between the ages of 13 and 18 ...&nbsp;&nbsp;&nbsp;&nbsp;She is like Africa, virgin and unexplored. 2. Between the ages of 19 and 35 ...&nbsp;&nbsp;&nbsp;&nbsp;She is like Asia, hot and exotic. 3. Between the ages of 36 and 45 ...&nbsp;&nbsp;&nbsp;&nbsp;She is like America, fully explored, breathtakingly beautiful,and free with her resources.4. Between the ages of 46 and 56 ...&nbsp;&nbsp;&nbsp;&nbsp;She is like Europe, exhausted but still has points of interest. 5. After 56 she is like Australia ...&nbsp;&nbsp;&nbsp;&nbsp;Everybody knows it's down there, but who gives a damn?",age womanhood1 age nbsp africa virgin unexplored age nbsp asia age nbsp america explored resource age nbsp europe exhausted point interest australia nbsp everybody know damn,"[(0, 0.0012930823), (1, 0.001099935), (2, 0.0010979936), (3, 0.0012784789), (4, 0.0014945755), (5, 0.0012619848), (6, 0.0013590886), (7, 0.9887663), (8, 0.0010982312), (9, 0.0012503412)]","[(7, 0.9887663), (4, 0.0014945755), (6, 0.0013590886), (0, 0.0012930823), (3, 0.0012784789), (5, 0.0012619848), (9, 0.0012503412), (1, 0.001099935), (8, 0.0010982312), (2, 0.0010979936)]",7
99,A bus station is where a bus stops.A train station is where a train stops.On my desk I have a work station...,bus station bus stop train station train stop desk work station,"[(0, 0.003004306), (1, 0.0025555538), (2, 0.0025510432), (3, 0.002970377), (4, 0.003472449), (5, 0.97345406), (6, 0.0031576632), (7, 0.0033779817), (8, 0.0025515952), (9, 0.0029050028)]","[(5, 0.97345406), (4, 0.003472449), (7, 0.0033779817), (6, 0.0031576632), (0, 0.003004306), (3, 0.002970377), (9, 0.0029050028), (1, 0.0025555538), (8, 0.0025515952), (2, 0.0025510432)]",5
100,Q: Whats the difference between greeting a Queen and greeting thePresident of the United  States?A: You only have to get on one knee to greet the queen.,whats difference greeting greeting thepresident state get knee greet queen,"[(0, 0.003295074), (1, 0.00280289), (2, 0.0027979426), (3, 0.0032578611), (4, 0.0038085256), (5, 0.0032158305), (6, 0.0034632736), (7, 0.0037049155), (8, 0.9704675), (9, 0.0031861598)]","[(8, 0.9704675), (4, 0.0038085256), (7, 0.0037049155), (6, 0.0034632736), (0, 0.003295074), (3, 0.0032578611), (5, 0.0032158305), (9, 0.0031861598), (1, 0.00280289), (2, 0.0027979426)]",8
