joke_id,joke,Processed_joke,cluster,sorted_topics,main_topic
35,"An explorer in the deepest Amazon suddenly finds himself surroundedby a bloodthirsty group of natives. Upon surveying the situation, hesays quietly to himself, ""Oh God, I'm screwed."" The sky darkens and a voice booms out, ""No, you are NOTscrewed. Pick up that stone at your feet and bash in the head of thechief standing in front of you."" So with the stone he bashes the life out of the chief. Standing abovethe lifeless body, breathing heavily looking at 100 angry natives... The voice booms out again, ""Okay ..... NOW you're screwed."" ",explorer amazon find group surveying situation hesays oh screwed darkens voice boom notscrewed stone foot bash head thechief standing stone life chief standing lifeless body breathing looking voice boom re screwed,"[(0, 0.001086722), (1, 0.99026155), (2, 0.0009227671), (3, 0.0010744492), (4, 0.0012560594), (5, 0.0010605874), (6, 0.0011421946), (7, 0.0012218886), (8, 0.0009229668), (9, 0.001050802)]","[(1, 0.99026155), (4, 0.0012560594), (7, 0.0012218886), (6, 0.0011421946), (0, 0.001086722), (3, 0.0010744492), (5, 0.0010605874), (9, 0.001050802), (8, 0.0009229668), (2, 0.0009227671)]",1
36,"A guy walks into a bar, orders a beer and says to the bartender,""Hey, I got this great Polish Joke..."" The barkeep glares at him and says in a warning tone of voice:""Before you go telling that joke you better know that I'm Polish, bothbouncers are Polish and so are most of my customers""""Okay"" says the customer,""I'll tell it very slowly."" ",guy walk bar order beer say bartender hey got joke barkeep glare say warning tone voice go telling joke know bothbouncers customer okay say customer ll tell,"[(0, 0.0012457736), (1, 0.0010596928), (2, 0.0010578225), (3, 0.0012317045), (4, 0.0014398951), (5, 0.0012158139), (6, 0.0013093652), (7, 0.9891773), (8, 0.0010580514), (9, 0.0012045964)]","[(7, 0.9891773), (4, 0.0014398951), (6, 0.0013093652), (0, 0.0012457736), (3, 0.0012317045), (5, 0.0012158139), (9, 0.0012045964), (1, 0.0010596928), (8, 0.0010580514), (2, 0.0010578225)]",7
37,"A Jewish young man was seeing a psychiatrist for an eating andsleeping disorder. ""I am so obsessed with my mother... As soon as I go to sleep, I startdreaming, and everyone in my dream turns into my mother. I wake up insuch a state, all I can do is go downstairs and eat a piece of toast.""The psychiatrist replies:""What, just one piece of toast, for a big boy like you?""",man seeing eating andsleeping disorder obsessed go startdreaming everyone dream turn wake state go psychiatrist reply piece toast boy,"[(0, 0.0017612652), (1, 0.0014981856), (2, 0.0014955412), (3, 0.0017413744), (4, 0.0020357126), (5, 0.0017189083), (6, 0.0018511703), (7, 0.98469895), (8, 0.0014958649), (9, 0.0017030489)]","[(7, 0.98469895), (4, 0.0020357126), (6, 0.0018511703), (0, 0.0017612652), (3, 0.0017413744), (5, 0.0017189083), (9, 0.0017030489), (1, 0.0014981856), (8, 0.0014958649), (2, 0.0014955412)]",7
38,"""May I take your order?"" the waiter asked. ""Yes, how do you prepare your chickens?"" ""Nothing special sir,"" he replied. ""We just tell them straight outthat they're going to die.""",may take order waiter asked yes prepare chicken nothing sir replied tell re going die,"[(0, 0.0022206595), (1, 0.0018889604), (2, 0.0018856261), (3, 0.0021955804), (4, 0.0025666915), (5, 0.9803783), (6, 0.0023340147), (7, 0.002496865), (8, 0.0018860343), (9, 0.0021472585)]","[(5, 0.9803783), (4, 0.0025666915), (7, 0.002496865), (6, 0.0023340147), (0, 0.0022206595), (3, 0.0021955804), (9, 0.0021472585), (1, 0.0018889604), (8, 0.0018860343), (2, 0.0018856261)]",5
39,What is the difference between men and women:A woman wants one man to satisfy her every need.A man wants every woman to satisfy his one need.,difference men woman woman want man satisfy need man want woman satisfy need,"[(0, 0.0025536628), (1, 0.0021722228), (2, 0.0021683888), (3, 0.002524823), (4, 0.9778952), (5, 0.0024922492), (6, 0.0026840162), (7, 0.0028712873), (8, 0.0021688582), (9, 0.002469255)]","[(4, 0.9778952), (7, 0.0028712873), (6, 0.0026840162), (0, 0.0025536628), (3, 0.002524823), (5, 0.0024922492), (9, 0.002469255), (1, 0.0021722228), (8, 0.0021688582), (2, 0.0021683888)]",4
40,"How many Irishmen does it take to change a lightbulb?Two, one to hold the lightbulb and the other to drink until the room spins. ",take change lightbulb hold lightbulb drink room spin,"[(0, 0.0040858146), (1, 0.0034755177), (2, 0.003469383), (3, 0.0040396713), (4, 0.0047224825), (5, 0.003987554), (6, 0.0042943778), (7, 0.0045940084), (8, 0.9633804), (9, 0.0039507635)]","[(8, 0.9633804), (4, 0.0047224825), (7, 0.0045940084), (6, 0.0042943778), (0, 0.0040858146), (3, 0.0040396713), (5, 0.003987554), (9, 0.0039507635), (1, 0.0034755177), (2, 0.003469383)]",8
41,"What does an atheist say during an orgasm?""Oh Darwin! Oh Darwin!...""",say darwin oh darwin,"[(0, 0.0078566065), (1, 0.006683068), (2, 0.0066712718), (3, 0.007767878), (4, 0.93199235), (5, 0.007667662), (6, 0.008257653), (7, 0.008833812), (8, 0.006672716), (9, 0.007596917)]","[(4, 0.93199235), (7, 0.008833812), (6, 0.008257653), (0, 0.0078566065), (3, 0.007767878), (5, 0.007667662), (9, 0.007596917), (1, 0.006683068), (8, 0.006672716), (2, 0.0066712718)]",4
42,"Two men are discussing the age old question: who enjoys sex more, theman or the woman?  A woman walks by and listens in for awhile and theninterrupts: ""Listen you guys. You know when your ear itches and you put in your little finger and wiggle it around for awhile?  Afterward,which feels better, your finger or your ear?""",men discussing age question enjoys sex woman woman walk listens theninterrupts listen guy know itch put finger wiggle feel finger ear,"[(0, 0.0015961248), (1, 0.0013577122), (2, 0.0013553158), (3, 0.001578099), (4, 0.98618376), (5, 0.0015577395), (6, 0.0016776002), (7, 0.0017946509), (8, 0.0013556092), (9, 0.0015433672)]","[(4, 0.98618376), (7, 0.0017946509), (6, 0.0016776002), (0, 0.0015961248), (3, 0.001578099), (5, 0.0015577395), (9, 0.0015433672), (1, 0.0013577122), (8, 0.0013556092), (2, 0.0013553158)]",4
43,"Arnold Swartzeneger and Sylvester Stallone are making a movie aboutthe lives of the great composers.  Stallone says ""I want to be Mozart."" Swartzeneger says: ""In that case...  I'll be Bach.""",swartzeneger sylvester stallone making movie life composer stallone say want swartzeneger say case bach,"[(0, 0.97906667), (1, 0.0020207306), (2, 0.002017164), (3, 0.00234874), (4, 0.0027457392), (5, 0.0023184381), (6, 0.0024968311), (7, 0.0026710418), (8, 0.0020176005), (9, 0.0022970473)]","[(0, 0.97906667), (4, 0.0027457392), (7, 0.0026710418), (6, 0.0024968311), (3, 0.00234874), (5, 0.0023184381), (9, 0.0022970473), (1, 0.0020207306), (8, 0.0020176005), (2, 0.002017164)]",0
44,"A horse walks into a bar. Bartender says:""So, why the long face?""",horse walk bar bartender say face,"[(0, 0.005375917), (1, 0.004572918), (2, 0.004564847), (3, 0.005315204), (4, 0.95346546), (5, 0.0052466313), (6, 0.005650335), (7, 0.006044574), (8, 0.004565835), (9, 0.0051982235)]","[(4, 0.95346546), (7, 0.006044574), (6, 0.005650335), (0, 0.005375917), (3, 0.005315204), (5, 0.0052466313), (9, 0.0051982235), (1, 0.004572918), (8, 0.004565835), (2, 0.004564847)]",4
45,"A boy comes home from school and tells his mother that he got a partin the school play.  ""What part?"" the mother asked. ""I play a Jewishhusband,"" the boy replied.  ""Go back to school and tell your teacher that you want a speaking role!""",boy come home school tell mother got school play part mother asked play jewishhusband boy replied go school tell teacher want speaking role,"[(0, 0.0014593118), (1, 0.0012413348), (2, 0.0012391438), (3, 0.001442831), (4, 0.0016867076), (5, 0.0014242167), (6, 0.0015338034), (7, 0.98732215), (8, 0.001239412), (9, 0.0014110762)]","[(7, 0.98732215), (4, 0.0016867076), (6, 0.0015338034), (0, 0.0014593118), (3, 0.001442831), (5, 0.0014242167), (9, 0.0014110762), (1, 0.0012413348), (8, 0.001239412), (2, 0.0012391438)]",7
46,"A couple has been married for 75 years. For the husband's 95thbirthday, his wife decides to surprise him by hiring a prostitute.That day, the doorbell rings. The husband uses his walker to get tothe door and opens it. A 21-year-old in a latex outfit smiles andsays, ""Hi, I here to give you super sex!"" The old man says, ""I'll take the soup.""",couple married year husband wife decides surprise hiring prostitute day doorbell ring husband get door year latex outfit smile andsays hi sex man say take soup,"[(0, 0.0012930656), (1, 0.0010999208), (2, 0.0010979794), (3, 0.0012784624), (4, 0.0014945562), (5, 0.0012619685), (6, 0.98867166), (7, 0.0014538971), (8, 0.0010982171), (9, 0.0012503251)]","[(6, 0.98867166), (4, 0.0014945562), (7, 0.0014538971), (0, 0.0012930656), (3, 0.0012784624), (5, 0.0012619685), (9, 0.0012503251), (1, 0.0010999208), (8, 0.0010982171), (2, 0.0010979794)]",6
47,"There was an engineer who had an exceptional gift for fixing all things mechanical.  After serving his company loyally for over 30 years, he happily retired.  Several years later the company contacted him regarding a seemingly impossible problem they were having with one of their multi-million dollar machines. They had tried everything and everyone else to get the machine fixed, but to no avail.  In desperation, they called on the retired engineer who had solved so many of their problems in the past.The engineer reluctantly took the challenge.  He spent a day studying the huge machine.  At the end of the day, he marked a small ""x"" in chalk on a particular component of the machine and proudly stated, ""This is where your problem is"".The part was replaced and the machine worked perfectly again. The company received a bill for $50,000 from the engineer for his service.They demanded an itemized accounting of his charges. The engineer responded briefly:One chalk mark                       $1 Knowing where to put it            $49,999It was paid in full and the engineer retired again in peace. ",engineer gift fixing thing serving company year retired year company contacted regarding problem multi dollar machine tried everything everyone get machine fixed desperation called retired solved problem engineer took challenge spent day studying machine end day marked chalk component machine stated problem part replaced machine worked company received bill engineer service demanded accounting charge engineer responded briefly chalk mark knowing put paid engineer retired peace,"[(0, 0.0005211914), (1, 0.0004433412), (2, 0.00044255867), (3, 0.0005153053), (4, 0.0006024055), (5, 0.0005086572), (6, 0.9954339), (7, 0.0005860172), (8, 0.00044265445), (9, 0.0005039641)]","[(6, 0.9954339), (4, 0.0006024055), (7, 0.0005860172), (0, 0.0005211914), (3, 0.0005153053), (5, 0.0005086572), (9, 0.0005039641), (1, 0.0004433412), (8, 0.00044265445), (2, 0.00044255867)]",6
48,"The graduate with a Science degree asks, ""Why does it work?""The graduate with an Engineering degree asks, ""How does it work?""The graduate with an Accounting degree Asks, ""How much will it cost?"" The graduate with a  Liberal Arts degree asks, ""Do you want fries with  that?""",graduate science degree asks work graduate engineering degree asks work graduate accounting degree asks cost graduate art degree asks want fry,"[(0, 0.0015960926), (1, 0.0013576848), (2, 0.0013552884), (3, 0.0015780671), (4, 0.98618406), (5, 0.001557708), (6, 0.0016775663), (7, 0.0017946147), (8, 0.0013555818), (9, 0.001543336)]","[(4, 0.98618406), (7, 0.0017946147), (6, 0.0016775663), (0, 0.0015960926), (3, 0.0015780671), (5, 0.001557708), (9, 0.001543336), (1, 0.0013576848), (8, 0.0013555818), (2, 0.0013552884)]",4
49,"Three engineering students were gathered together discussing thepossible designers of the human body.  One said, ""It was a mechanical engineer. Just look at all the joints.""  Another said, ""No, it was an electrical engineer.  The nervous systems many thousands of electricalconnections.""  The last said, ""Actually it was a civil engineer. Who else would run a toxic waste pipeline through a recreational area?""",engineering student gathered discussing designer body said engineer look joint said engineer system electricalconnections said engineer would run waste pipeline area,"[(0, 0.0015961411), (1, 0.001357726), (2, 0.0013553295), (3, 0.0015781152), (4, 0.0018448583), (5, 0.0015577554), (6, 0.0016776173), (7, 0.98613346), (8, 0.001355623), (9, 0.0015433829)]","[(7, 0.98613346), (4, 0.0018448583), (6, 0.0016776173), (0, 0.0015961411), (3, 0.0015781152), (5, 0.0015577554), (9, 0.0015433829), (1, 0.001357726), (8, 0.001355623), (2, 0.0013553295)]",7
50,"A guy goes into confession and says to the priest, ""Father, I'm 80 yearsold, widower, with 11 grandchildren. Last night I met two beautiful flightattendants. They took me home and I made love to both of them. Twice.""The priest said: ""Well, my son, when was the last time you were inconfession?"" ""Never Father, I'm Jewish."" ""So then, why are you telling me?"" ""I'm telling everybody.""",guy go confession say father yearsold grandchild night met flightattendants took home made priest said son time inconfession telling telling everybody,"[(0, 0.0015961064), (1, 0.98569685), (2, 0.0013553002), (3, 0.0015780808), (4, 0.0018448181), (5, 0.0015577215), (6, 0.0016775809), (7, 0.0017946302), (8, 0.0013555936), (9, 0.0015433494)]","[(1, 0.98569685), (4, 0.0018448181), (7, 0.0017946302), (6, 0.0016775809), (0, 0.0015961064), (3, 0.0015780808), (5, 0.0015577215), (9, 0.0015433494), (8, 0.0013555936), (2, 0.0013553002)]",1
51,Did you hear that Clinton has announced there is a new national bird?  The spread eagle.,clinton announced bird spread eagle,"[(0, 0.0063838093), (1, 0.005430262), (2, 0.005420677), (3, 0.0063117137), (4, 0.00737856), (5, 0.0062302845), (6, 0.006709676), (7, 0.007177828), (8, 0.0054218504), (9, 0.9435353)]","[(9, 0.9435353), (4, 0.00737856), (7, 0.007177828), (6, 0.006709676), (0, 0.0063838093), (3, 0.0063117137), (5, 0.0062302845), (1, 0.005430262), (8, 0.0054218504), (2, 0.005420677)]",9
52,Q: What do Monica Lewinsky and Bob Dole have in common?A: They were both upset when Bill finished first.,monica lewinsky bill finished,"[(0, 0.007856819), (1, 0.0066832486), (2, 0.0066714524), (3, 0.9306776), (4, 0.0090811), (5, 0.0076678693), (6, 0.008257876), (7, 0.008834051), (8, 0.0066728964), (9, 0.007597123)]","[(3, 0.9306776), (4, 0.0090811), (7, 0.008834051), (6, 0.008257876), (0, 0.007856819), (5, 0.0076678693), (9, 0.007597123), (1, 0.0066832486), (8, 0.0066728964), (2, 0.0066714524)]",3
53,"One Sunday morning William burst into the living room and said,""Dad! Mom! I have some great news for you! I am getting marriedto the most beautiful girl in town. She lives a block away andher name is Susan.""After dinner, William's dad took him aside. ""Son, I have to talkwith you. Your mother and I have been married 30 years.. She's awonderful wife but she has never offered much excitement in thebedroom, so I used to fool around with women a lot. Susan isactually your half-sister, and I'm afraid you can't marry her.""William was heart-broken. After eight months he eventuallystarted dating girls again. A year later he came home and veryproudly announced, ""Dianne said yes! We're getting married inJune.""Again his father insisted on another private conversation andbroke the sad news. ""Dianne is your half-sister too, William. I'mawfully sorry about this.""William was furious! He finally decided to go to his mother withthe news.""Dad has done so much harm.. I guess I'm never going to getmarried,""  he complained. ""Every time I fall in love, Dad tellsme the girl is my half-sister.""His mother just shook her head. ""Don't pay any attention to whathe says, dear. He's not really your father.""",sunday morning william burst living room said mom news getting marriedto town life block name dinner william dad took talkwith mother married year wife offered excitement thebedroom used fool woman lot susan marry heart broken month eventuallystarted dating girl year came announced dianne said re getting married injune father insisted conversation andbroke news dianne half sister william decided go news dad done harm guess going getmarried complained time fall love dad tellsme girl half sister mother shook head pay attention whathe say dear,"[(0, 0.9963993), (1, 0.00034758225), (2, 0.00034696874), (3, 0.00040400252), (4, 0.00047228963), (5, 0.00039879038), (6, 0.00042947542), (7, 0.00045944107), (8, 0.00034704382), (9, 0.00039511095)]","[(0, 0.9963993), (4, 0.00047228963), (7, 0.00045944107), (6, 0.00042947542), (3, 0.00040400252), (5, 0.00039879038), (9, 0.00039511095), (1, 0.00034758225), (8, 0.00034704382), (2, 0.00034696874)]",0
54,"The Pope dies and, naturally, goes to heaven. He's met by the receptioncommittee, and after a whirlwind tour he is told that he can enjoy anyof the myriad of recreations available.He decides that he wants to read all of the ancient original text of theHoly Scriptures, so he spends the next eon or so learning languages.After becoming a linguistic master, he sits down in the library andbegins to pour over every version of the Bible, working back from mostrecent ""Easy Reading"" to the original script.All of a sudden there is a scream in the library. The Angels comerunning in only to find the Pope huddled in his chair, crying to himselfand muttering, ""An 'R'! The scribes left out the 'R'."" A particularly concerned Angel takes him aside, offering comfort, askshim what the problem is and what does he mean. After collecting hiswits, the Pope sobs again, ""It's the letter 'R'. They left out the 'R'.The word was supposed to be CELEBRATE!""",pope dy go met receptioncommittee told enjoy anyof recreation decides want text scripture spends eon learning language becoming master sits andbegins pour version working reading script scream library angel comerunning find pope huddled chair cry himselfand muttering scribe left angel take offering comfort askshim problem mean collecting hiswits pope letter left word supposed celebrate,"[(0, 0.00062672806), (1, 0.0005331139), (2, 0.0005321729), (3, 0.0006196501), (4, 0.00072438736), (5, 0.0006116558), (6, 0.00065871986), (7, 0.99455523), (8, 0.0005322881), (9, 0.0006060124)]","[(7, 0.99455523), (4, 0.00072438736), (6, 0.00065871986), (0, 0.00062672806), (3, 0.0006196501), (5, 0.0006116558), (9, 0.0006060124), (1, 0.0005331139), (8, 0.0005322881), (2, 0.0005321729)]",7
55,"A woman has twins, and gives them up for adoption.  One ofthem goes to a family in Egypt and is named ""Amal.""  The other goes toa  family in Spain; they name him ""Juan.""  Years later, Juan sends apicture of himself to his mom.  Upon receiving the picture, she tellsher husband that she wishes she also had a picture of Amal.  Her husband responds, ""But they are twins-if you've seen Juan, you'veseen   Amal.",woman twin adoption ofthem go family named go family spain name year sends apicture receiving picture tellsher husband wish picture husband responds ve seen amal,"[(0, 0.001344093), (1, 0.9879552), (2, 0.0011413082), (3, 0.0013289135), (4, 0.001553535), (5, 0.0013117688), (6, 0.0014127033), (7, 0.0015112713), (8, 0.0011415553), (9, 0.0012996659)]","[(1, 0.9879552), (4, 0.001553535), (7, 0.0015112713), (6, 0.0014127033), (0, 0.001344093), (3, 0.0013289135), (5, 0.0013117688), (9, 0.0012996659), (8, 0.0011415553), (2, 0.0011413082)]",1
56,"A man and Cindy Crawford get stranded on a desert island.  After a coupleof days they fall in love and start sleeping together.  Time pass theman seems frustrated, Cindy asks if there is anything she can do?  Hesays there is one thing, ""Could you put on this baseball cap and go tothe other side of the island and answer me when I call you Bob?""  Sheagrees.  Next day he is walking on the other side of the island, runsinto her and says ""Hi Bob!""  She says ""Hello, what's up?""  He replies: ""Bob you won't believe it: I've been sleeping with CindyCrawford for the past two weeks!!!!""",man cindy crawford get stranded desert island coupleof day fall love start sleeping time theman seems frustrated cindy asks anything hesays thing could put baseball cap go side island answer call bob sheagrees day walking side island runsinto say bob say reply bob won believe ve sleeping cindycrawford week,"[(0, 0.00069023547), (1, 0.00058713526), (2, 0.00058609893), (3, 0.0006824403), (4, 0.00079779077), (5, 0.0006736359), (6, 0.0007254691), (7, 0.99400353), (8, 0.00058622577), (9, 0.0006674207)]","[(7, 0.99400353), (4, 0.00079779077), (6, 0.0007254691), (0, 0.00069023547), (3, 0.0006824403), (5, 0.0006736359), (9, 0.0006674207), (1, 0.00058713526), (8, 0.00058622577), (2, 0.00058609893)]",7
57,Why are there so many Jones's in the phone book?Because they all have phones.,jones phone book phone,"[(0, 0.007856642), (1, 0.006683098), (2, 0.0066713016), (3, 0.007767913), (4, 0.009080895), (5, 0.0076676966), (6, 0.00825769), (7, 0.008833852), (8, 0.92958397), (9, 0.0075969514)]","[(8, 0.92958397), (4, 0.009080895), (7, 0.008833852), (6, 0.00825769), (0, 0.007856642), (3, 0.007767913), (5, 0.0076676966), (9, 0.0075969514), (1, 0.006683098), (2, 0.0066713016)]",8
58,"How many teddybears does it take to change a lightbulb?It takes only one teddybear, but it takes a whole lot of lightbulbs.",teddybears take change lightbulb take take lot lightbulb,"[(0, 0.00408576), (1, 0.0034754716), (2, 0.003469337), (3, 0.0040396177), (4, 0.0047224197), (5, 0.9638983), (6, 0.004294321), (7, 0.0045939474), (8, 0.0034700881), (9, 0.003950711)]","[(5, 0.9638983), (4, 0.0047224197), (7, 0.0045939474), (6, 0.004294321), (0, 0.00408576), (3, 0.0040396177), (9, 0.003950711), (1, 0.0034754716), (8, 0.0034700881), (2, 0.003469337)]",5
59,"The Chukcha (Russian Eskimo) phones up the Russian Parliament Building.  A guard answers. Chukcha:  ""What is required to become Parliament member?""Guard:  ""What are you, an idiot?""Chukcha:  ""Is it required?""",chukcha eskimo phone parliament building guard answer chukcha required member guard idiot chukcha required,"[(0, 0.0023755352), (1, 0.0020207025), (2, 0.97870857), (3, 0.002348707), (4, 0.0027457008), (5, 0.0023184058), (6, 0.0024967962), (7, 0.0026710045), (8, 0.0020175723), (9, 0.0022970152)]","[(2, 0.97870857), (4, 0.0027457008), (7, 0.0026710045), (6, 0.0024967962), (0, 0.0023755352), (3, 0.002348707), (5, 0.0023184058), (9, 0.0022970152), (1, 0.0020207025), (8, 0.0020175723)]",2
60,What did the Buddhist say to the hot dog vendor?Make me one with everything.,say dog vendor make everything,"[(0, 0.0063838116), (1, 0.005430264), (2, 0.005420679), (3, 0.94367427), (4, 0.007378563), (5, 0.006230287), (6, 0.006709678), (7, 0.0071778307), (8, 0.005421852), (9, 0.0061728037)]","[(3, 0.94367427), (4, 0.007378563), (7, 0.0071778307), (6, 0.006709678), (0, 0.0063838116), (5, 0.006230287), (9, 0.0061728037), (1, 0.005430264), (8, 0.005421852), (2, 0.005420679)]",3
61,"During a recent publicity outing, Hillary sneaked off to visit afortune teller of some local repute.  In a dark and hazy room, peeringinto a crystal ball, the mystic delivered grave news.""There's no easy way to say this, so I'll just be blunt: Prepareyourself to be a widow.  Your husband will die a violent and horribledeath this year.""Visibly shaken, Hillary stared at the woman's lined face, then at the single flickering candle, then down at her hands.  She took a few deep breaths to compose herself.  She simply had to know.  She met thefortune teller's gaze, steadied her voice, and asked her question.""Will I be acquitted?""",publicity outing sneaked visit afortune teller repute dark hazy room ball delivered grave news way say blunt prepareyourself widow husband die horribledeath year shaken stared woman lined face flickering hand took breath compose know thefortune teller gaze steadied voice asked question acquitted,"[(0, 0.0008043675), (1, 0.00068421935), (2, 0.00068301166), (3, 0.00079528335), (4, 0.9930373), (5, 0.00078502315), (6, 0.000845427), (7, 0.00090441474), (8, 0.0006831595), (9, 0.0007777802)]","[(4, 0.9930373), (7, 0.00090441474), (6, 0.000845427), (0, 0.0008043675), (3, 0.00079528335), (5, 0.00078502315), (9, 0.0007777802), (1, 0.00068421935), (8, 0.0006831595), (2, 0.00068301166)]",4
62,"A group of  managers were given the assignment to measure theheight of a flagpole. So they go out to the flagpole with laddersand tape measures, and they're falling off the ladders, droppingthe tape measures - the whole thing is just a mess.An engineer comes along and sees what they're trying to do,walks over, pulls the flagpole out of the ground, lays it flat,measures it from end to end, gives the measurement to one of themanagers and walks away.After the engineer has gone, one manager turns to another andlaughs. ""Isn't that just like an engineer, we're looking for the height and he gives us the length.""",group manager given measure theheight laddersand tape measure re falling ladder droppingthe tape measure thing mess engineer come see re trying walk flagpole ground lay measure end give measurement themanagers walk gone manager turn andlaughs isn engineer re looking length,"[(0, 0.0008442435), (1, 0.0007181391), (2, 0.0007168715), (3, 0.00083470903), (4, 0.9926921), (5, 0.00082394015), (6, 0.00088733854), (7, 0.00094925053), (8, 0.0007170267), (9, 0.0008163382)]","[(4, 0.9926921), (7, 0.00094925053), (6, 0.00088733854), (0, 0.0008442435), (3, 0.00083470903), (5, 0.00082394015), (9, 0.0008163382), (1, 0.0007181391), (8, 0.0007170267), (2, 0.0007168715)]",4
