joke_id,joke,Processed_joke,cluster,sorted_topics,main_topic
63," An engineer, a physicist and a mathematician are sleeping in a room. There is a fire in the room. The engineer wakes up, sees the fire, picks up the bucket of water and douses the fire and goes back to sleep.    Again there is fire in the room. This time, the physicist wakes up, notices the bucket, fills it with water, calculates the optimal trajectory and douses the fire in minimum amount of water and goes back to sleep.    Again there is fire. This time the mathematician wakes up.  He looks at the fire, looks at the bucket and the water and exclaims, ""A solution exists"" and goes back to sleep. ",engineer physicist sleeping room fire room engineer wake see fire pick bucket water douses fire go fire room time wake notice bucket water calculates trajectory douses fire amount water go fire time wake look fire look bucket water exclaims solution exists go sleep,"[(0, 0.00063916825), (1, 0.00063690334), (2, 0.00082448364), (3, 0.00065213686), (4, 0.0009823701), (5, 0.0007668997), (6, 0.00071685226), (7, 0.000910331), (8, 0.99314344), (9, 0.00072745496)]","[(8, 0.99314344), (4, 0.0009823701), (7, 0.000910331), (2, 0.00082448364), (5, 0.0007668997), (9, 0.00072745496), (6, 0.00071685226), (3, 0.00065213686), (0, 0.00063916825), (1, 0.00063690334)]",8
64, What is the rallying cry of the International Dyslexic Pride movement?  Dyslexics Untie! ,rallying cry dyslexic pride movement dyslexics,"[(0, 0.004372012), (1, 0.0043565193), (2, 0.0056395982), (3, 0.004460719), (4, 0.9537353), (5, 0.0052457154), (6, 0.0049033826), (7, 0.0062268074), (8, 0.006084091), (9, 0.0049759066)]","[(4, 0.9537353), (7, 0.0062268074), (8, 0.006084091), (2, 0.0056395982), (5, 0.0052457154), (9, 0.0049759066), (6, 0.0049033826), (3, 0.004460719), (0, 0.004372012), (1, 0.0043565193)]",4
65," Two Rednecks were seated at the end of a bar when a young lady seated a few stools up began to choke on a piece of hamburger.  She was turning blue and obviously in serious respiratory distress. One said to the other, ""That gal there is having a bad time!""  The other agreed and said ""Think we should go help?""  ""You bet,"" said the first,and with that, he ran over and said, ""Can you breathe??""  She shook her head no.  He said, ""Can you speak??""  She again shook her head no. With that, he pulled up her skirt and licked her on the butt.  She was so shocked, she coughed up the obstruction and began to breathe-with great relief.  The redneck walked back to his friend and said, ""Funny how that hind lick maneuver always works."" ",redneck seated bar lady seated stool began piece hamburger turning respiratory distress said time agreed said think go help bet said ran said shook head said shook head pulled skirt licked shocked obstruction began relief redneck walked friend said hind maneuver work,"[(0, 0.00065428094), (1, 0.0006519625), (2, 0.00084397796), (3, 0.0006675562), (4, 0.0010055976), (5, 0.0007850326), (6, 0.00073380175), (7, 0.0009318551), (8, 0.9929813), (9, 0.0007446551)]","[(8, 0.9929813), (4, 0.0010055976), (7, 0.0009318551), (2, 0.00084397796), (5, 0.0007850326), (9, 0.0007446551), (6, 0.00073380175), (3, 0.0006675562), (0, 0.00065428094), (1, 0.0006519625)]",8
66," A lawyer opened the door of his BMW, when suddenly a car came along and hit the door, ripping it off completely.  When the police arrived at the scene, the lawyer was complaining bitterly about the damage to his precious BMW.    ""Officer, look what they've done to my Beeeeemer!!!"", he whined.    ""You lawyers are so materialistic, you make me sick!!!""  retorted the officer.  ""You're so worried about your stupid BMW, that you didn't even notice that your left arm was ripped off!!!""    ""Oh my gaaaad..."", replied the lawyer, finally noticing the bloody left shoulder where his arm once was.  ""Where's my Rolex???!!!!"" ",lawyer opened bmw car came door ripping police arrived scene lawyer complaining damage officer look done beeeeemer whined lawyer make retorted officer re worried bmw didn left arm ripped gaaaad replied lawyer noticing bloody left arm rolex,"[(0, 0.00074189494), (1, 0.000739266), (2, 0.0009569941), (3, 0.00075694785), (4, 0.0011402561), (5, 0.0008901554), (6, 0.0008320643), (7, 0.99206567), (8, 0.001032421), (9, 0.00084437104)]","[(7, 0.99206567), (4, 0.0011402561), (8, 0.001032421), (2, 0.0009569941), (5, 0.0008901554), (9, 0.00084437104), (6, 0.0008320643), (3, 0.00075694785), (0, 0.00074189494), (1, 0.000739266)]",7
67," Once upon a time, two brooms fell in love and decided to get married. Before the ceremony, the bride broom informed the groom broom that  she was expecting a little whiskbroom. The groom broom was aghast!   ""How is this possible?"" he asked. ""We've never swept together! ",time broom fell decided get married ceremony bride broom informed groom broom expecting whiskbroom groom broom asked ve swept,"[(0, 0.0014325146), (1, 0.0014274385), (2, 0.0018478465), (3, 0.00146158), (4, 0.0022017045), (5, 0.0017187886), (6, 0.0016066213), (7, 0.002040249), (8, 0.0019934874), (9, 0.98426974)]","[(9, 0.98426974), (4, 0.0022017045), (7, 0.002040249), (8, 0.0019934874), (2, 0.0018478465), (5, 0.0017187886), (6, 0.0016066213), (3, 0.00146158), (0, 0.0014325146), (1, 0.0014274385)]",9
68," A man piloting a hot air balloon discovers he has wandered off course and is hopelessly lost. He descends to a lower altitude and locates a man down on the ground. He lowers the balloon further and shouts ""Excuse me, can you tell me where I am?""   The man below says: ""Yes, you're in a hot air balloon, about 30 feet above this field.""   ""You must work in Information Technology,"" says the balloonist.   ""Yes I do,"" replies the man. ""And how did you know that?""   ""Well,"" says the balloonist, ""what you told me is technically correct, but of no use to anyone.""   The man below says, ""You must work in management.""   ""I do,"" replies the balloonist, ""how did you know?""   ""Well,"" says the man, ""you don't know where you are, or where you're going, but you expect my immediate help. You're in the same position you were before we met, but now it's my fault!""   ",man piloting air balloon discovers wandered course lost descends altitude locates man ground balloon shout excuse tell man say air balloon foot field must work information technology say yes reply man know say balloonist told use anyone man say must work management balloonist know say man know re going expect help re position met fault,"[(0, 0.0005005617), (1, 0.00049878797), (2, 0.00064569066), (3, 0.00051071803), (4, 0.0007693388), (5, 0.0006005941), (6, 0.0005613996), (7, 0.99464667), (8, 0.0006965817), (9, 0.00056970306)]","[(7, 0.99464667), (4, 0.0007693388), (8, 0.0006965817), (2, 0.00064569066), (5, 0.0006005941), (9, 0.00056970306), (6, 0.0005613996), (3, 0.00051071803), (0, 0.0005005617), (1, 0.00049878797)]",7
69," This guys wife asks, ""Honey if I died would you remarry?"" and he replies, ""Well, after a considerable period of grieving, we all need companionship, I guess I would.""   She then asks, ""If I died and you remarried, would she live in this house?"" and he replies, ""We've spent a lot of time and money getting this house just the way we want it. I'm not going to get rid of my house, I guess she would.""   ""If I died and you remarried, and she lived in this house, would she sleep in our bed?"" and he says, ""That bed is brand new, we just paid two thousand dollars for it, it's going to last a long time, I guess she would.""   So she asks, ""If I died and you remarried, and she lived in this house, and slept in our bed, would she use my golf clubs?""   ""Oh no, she's left handed."" ",wife asks honey died would remarry period grieving companionship guess would asks remarried would live house reply spent lot time money getting house way want going get house guess would died lived house would sleep bed say bed brand paid thousand dollar going time guess would asks died lived house slept bed would use golf club oh left handed,"[(0, 0.00046681234), (1, 0.00046515817), (2, 0.0006021562), (3, 0.99481905), (4, 0.0007174676), (5, 0.0005601002), (6, 0.00052354834), (7, 0.00066485425), (8, 0.000649616), (9, 0.00053129194)]","[(3, 0.99481905), (4, 0.0007174676), (7, 0.00066485425), (8, 0.000649616), (2, 0.0006021562), (5, 0.0005601002), (9, 0.00053129194), (6, 0.00052354834), (0, 0.00046681234), (1, 0.00046515817)]",3
70," Employer to applicant: ""In this job we need someone who is responsible.""   Applicant: ""I'm the one you want. On my last job, every time anything went wrong, they said I was responsible.""   ",employer job need someone want job time anything went said,"[(0, 0.0026798968), (1, 0.9701928), (2, 0.0034568848), (3, 0.0027342713), (4, 0.0041188695), (5, 0.0032154478), (6, 0.0030056094), (7, 0.0038168244), (8, 0.003729344), (9, 0.003050064)]","[(1, 0.9701928), (4, 0.0041188695), (7, 0.0038168244), (8, 0.003729344), (2, 0.0034568848), (5, 0.0032154478), (9, 0.003050064), (6, 0.0030056094), (3, 0.0027342713), (0, 0.0026798968)]",1
71," At a recent Sacramento PC Users Group meeting, a company was demonstrating its latest speech- recognition software.   A representative from the company was just about ready to start the demonstration and asked everyone in the room to quiet down.   Just then someone in the back of the room yelled,  ""Format C: Return.""    Someone else chimed in:  ""Yes, Return""    Unfortunately, the software worked.   ",pc user group meeting company demonstrating speech recognition software company start demonstration asked everyone room someone room yelled return someone chimed return software worked,"[(0, 0.0011381856), (1, 0.9873405), (2, 0.0014681822), (3, 0.0011612792), (4, 0.0017493353), (5, 0.0013656409), (6, 0.0012765198), (7, 0.0016210531), (8, 0.001583899), (9, 0.0012954003)]","[(1, 0.9873405), (4, 0.0017493353), (7, 0.0016210531), (8, 0.001583899), (2, 0.0014681822), (5, 0.0013656409), (9, 0.0012954003), (6, 0.0012765198), (3, 0.0011612792), (0, 0.0011381856)]",1
72," On the first day of college, the Dean addressed the students, pointing out some of the rules:  ""The female dormitory will be out-of-bounds for all male students and the male dormitory to the female students. Anybody caught breaking this rule will be finded $20 the first time."" He continued, ""Anybody  caught breaking this rule the second time will be fined $60. Being caught a third time will cost you a fine of $180. Are there any questions ?""   At this point, a male student in the crowd inquired:  ""How much for a season pass ?""  ",day college dean addressed student pointing rule dormitory student student anybody caught breaking rule finded time continued anybody caught breaking rule time fined time cost question point male student crowd inquired season pas,"[(0, 0.0008309098), (1, 0.00082796544), (2, 0.0010718172), (3, 0.00084776885), (4, 0.9912073), (5, 0.000996959), (6, 0.00093189796), (7, 0.0011834176), (8, 0.0011562941), (9, 0.0009456813)]","[(4, 0.9912073), (7, 0.0011834176), (8, 0.0011562941), (2, 0.0010718172), (5, 0.000996959), (9, 0.0009456813), (6, 0.00093189796), (3, 0.00084776885), (0, 0.0008309098), (1, 0.00082796544)]",4
73," Q: What is the difference between George  Washington, Richard Nixon, and Bill Clinton?   A: Washington couldn't tell a lie, Nixon couldn't   tell the truth, and Clinton doesn't know the  difference . ",difference george richard nixon bill clinton washington couldn tell couldn tell clinton doesn know difference,"[(0, 0.0018061532), (1, 0.001799753), (2, 0.002329815), (3, 0.0018427997), (4, 0.0027759688), (5, 0.9802784), (6, 0.0020256718), (7, 0.0025724014), (8, 0.0025134427), (9, 0.0020556326)]","[(5, 0.9802784), (4, 0.0027759688), (7, 0.0025724014), (8, 0.0025134427), (2, 0.002329815), (9, 0.0020556326), (6, 0.0020256718), (3, 0.0018427997), (0, 0.0018061532), (1, 0.001799753)]",5
74," Q: How many stalkers does it take to change a light bulb?   A:  Two . One to replace the bulb, and the other to watch it day and night. ",stalker take change bulb replace watch day night,"[(0, 0.0033229613), (1, 0.0033111863), (2, 0.0042863945), (3, 0.96311945), (4, 0.005107228), (5, 0.0039870227), (6, 0.0037268314), (7, 0.0047327047), (8, 0.0046242326), (9, 0.0037819536)]","[(3, 0.96311945), (4, 0.005107228), (7, 0.0047327047), (8, 0.0046242326), (2, 0.0042863945), (5, 0.0039870227), (9, 0.0037819536), (6, 0.0037268314), (0, 0.0033229613), (1, 0.0033111863)]",3
75, Q: Do you know the difference between an intelligent male and the Sasquatch?   A:  There have been actual reported sightings of the Sasquatch . ,know difference sasquatch reported sasquatch,"[(0, 0.0051912395), (1, 0.005172844), (2, 0.006696346), (3, 0.005296569), (4, 0.00797868), (5, 0.0062286574), (6, 0.005822179), (7, 0.9444811), (8, 0.0072241286), (9, 0.0059082923)]","[(7, 0.9444811), (4, 0.00797868), (8, 0.0072241286), (2, 0.006696346), (5, 0.0062286574), (9, 0.0059082923), (6, 0.005822179), (3, 0.005296569), (0, 0.0051912395), (1, 0.005172844)]",7
76," There once was a man and a woman that both  got in  a terrible car wreck. Both of their vehicles   were completely destroyed, buy fortunately, no one  was   hurt.  In thankfulness, the woman said to the  man, 'We are both okay, so we should celebrate. I have   a  bottle of wine in my car, let's open it.'          So the woman got the bottleout of the car, and  handed it to the man. The man took a really big drink,  and handed the woman the bottle. The  woman  closed the bottle and put it down. The man  asked,   'Aren't you going to take a drink?'    The woman cleverly replied,   'No, I think I'll  just  wait for the cops to get here.'  ",man woman got car wreck vehicle destroyed buy hurt thankfulness woman said man okay celebrate bottle wine car let woman got car handed man man took drink handed woman bottle woman closed bottle put man asked going take drink woman replied think wait cop get,"[(0, 0.0006109657), (1, 0.0006088007), (2, 0.00078810425), (3, 0.99321914), (4, 0.0009390242), (5, 0.00073306117), (6, 0.000685222), (7, 0.00087016367), (8, 0.0008502198), (9, 0.0006953568)]","[(3, 0.99321914), (4, 0.0009390242), (7, 0.00087016367), (8, 0.0008502198), (2, 0.00078810425), (5, 0.00073306117), (9, 0.0006953568), (6, 0.000685222), (0, 0.0006109657), (1, 0.0006088007)]",3
77, If pro- is the opposite of con- then congress must be the  opposite  of progress. ,con congress must opposite progress,"[(0, 0.942278), (1, 0.0051729055), (2, 0.006696426), (3, 0.0052966317), (4, 0.007978775), (5, 0.0062287315), (6, 0.005822248), (7, 0.007393675), (8, 0.0072242143), (9, 0.0059083626)]","[(0, 0.942278), (4, 0.007978775), (7, 0.007393675), (8, 0.0072242143), (2, 0.006696426), (5, 0.0062287315), (9, 0.0059083626), (6, 0.005822248), (3, 0.0052966317), (1, 0.0051729055)]",0
78, Q: What's the difference between the government  and  the Mafia?   A:  One of them is organized . ,difference government mafia organized,"[(0, 0.0063885697), (1, 0.0063659316), (2, 0.93081784), (3, 0.0065181926), (4, 0.009818917), (5, 0.0076652626), (6, 0.0071650315), (7, 0.009098876), (8, 0.008890334), (9, 0.0072710067)]","[(2, 0.93081784), (4, 0.009818917), (7, 0.009098876), (8, 0.008890334), (5, 0.0076652626), (9, 0.0072710067), (6, 0.0071650315), (3, 0.0065181926), (0, 0.0063885697), (1, 0.0063659316)]",2
79," Q: Ever wonder why the IRS calls it Form 1040?   A: Because for every $50 that you earn,  you get 10 and they get 40 . ",wonder irs call form earn get get,"[(0, 0.0037759347), (1, 0.0037625544), (2, 0.0048706993), (3, 0.0038525476), (4, 0.96004295), (5, 0.0045305183), (6, 0.004234859), (7, 0.005377849), (8, 0.0052545904), (9, 0.004297495)]","[(4, 0.96004295), (7, 0.005377849), (8, 0.0052545904), (2, 0.0048706993), (5, 0.0045305183), (9, 0.004297495), (6, 0.004234859), (3, 0.0038525476), (0, 0.0037759347), (1, 0.0037625544)]",4
80," Hillary, Bill Clinton and the Pope are sitting together on an airplane.  Bill says ""I could throw one thousand dollar bill out of this plane and make one person very happy.""  Hillary says ""I could throw 10 hundred dollar bills out of the plane and make 10 people very happy.""   The Pope chips in and says "" I could throw Bill out of the airplane and make the whole  country happy ."" ",bill clinton pope sitting bill say could throw dollar bill plane make person say could throw dollar bill plane make people pope chip say could throw bill make country,"[(0, 0.0009441906), (1, 0.0009408448), (2, 0.0012179418), (3, 0.0009633481), (4, 0.99000853), (5, 0.0011328779), (6, 0.0010589468), (7, 0.001344757), (8, 0.0013139356), (9, 0.0010746092)]","[(4, 0.99000853), (7, 0.001344757), (8, 0.0013139356), (2, 0.0012179418), (5, 0.0011328779), (9, 0.0010746092), (6, 0.0010589468), (3, 0.0009633481), (0, 0.0009441906), (1, 0.0009408448)]",4
81," An Asian man goes into a New York CityBank to exchange 10,000 yen for American Currency.  The teller gives him $72.00.  The next month the Asian man goes into the same bank with 10,000 yen and receives $62.00. He asks, ""How come? Only $62.00?"" The teller says ""Fluctuations- Fluctuations!""   Whereupon the Asian man looks back at the teller and says "" Fluk you Amelicans too !"" ",man go york citybank exchange yen currency teller month man go bank yen receives asks come teller say fluctuation fluctuation whereupon man look teller say fluk amelicans,"[(0, 0.0010132845), (1, 0.001009694), (2, 0.0013070682), (3, 0.0010338438), (4, 0.0015573684), (5, 0.0012157795), (6, 0.0011364383), (7, 0.98916316), (8, 0.0014100866), (9, 0.001153247)]","[(7, 0.98916316), (4, 0.0015573684), (8, 0.0014100866), (2, 0.0013070682), (5, 0.0012157795), (9, 0.001153247), (6, 0.0011364383), (3, 0.0010338438), (0, 0.0010132845), (1, 0.001009694)]",7
82," Q: How do you keep a computer programmer in the  shower all day long?   A: Give them a shampoo with a label that says  ""rinse, lather, repeat"" . ",keep computer programmer shower day shampoo label say rinse repeat,"[(0, 0.0026799715), (1, 0.002670475), (2, 0.0034569814), (3, 0.0027343477), (4, 0.97164047), (5, 0.0032155376), (6, 0.0030056934), (7, 0.003816931), (8, 0.0037294484), (9, 0.0030501494)]","[(4, 0.97164047), (7, 0.003816931), (8, 0.0037294484), (2, 0.0034569814), (5, 0.0032155376), (9, 0.0030501494), (6, 0.0030056934), (3, 0.0027343477), (0, 0.0026799715), (1, 0.002670475)]",4
83,"  What a woman says :   ""This place is a mess!  C'mon,  You and I need to clean up,  Your stuff is lying on the floor and  you'll have no clothes to wear,  if we don't do laundry right now!""     What a man hears :   blah, blah, blah, blah,  C'mon   blah, blah, blah, blah,  you and I   blah, blah, blah, blah,  on the floor   blah, blah, blah, blah,  no clothes   blah, blah, blah, blah,  RIGHT NOW!  ",woman say place mess mon need stuff lying floor ll clothes wear man hears blah blah blah mon blah blah blah blah blah blah blah blah floor blah blah blah blah clothes blah blah blah right,"[(0, 0.00076229003), (1, 0.00075958885), (2, 0.0009833024), (3, 0.9915396), (4, 0.0011716023), (5, 0.00091462623), (6, 0.0008549382), (7, 0.0010856864), (8, 0.0010608027), (9, 0.0008675832)]","[(3, 0.9915396), (4, 0.0011716023), (7, 0.0010856864), (8, 0.0010608027), (2, 0.0009833024), (5, 0.00091462623), (9, 0.0008675832), (6, 0.0008549382), (0, 0.00076229003), (1, 0.00075958885)]",3
84," Q: What is the difference between Mechanical Engineers and Civil  Engineers?    A: Mechanical Engineers build  weapons , Civil Engineers build  targets . ",difference engineer engineer engineer build engineer build target,"[(0, 0.0033228423), (1, 0.0033110676), (2, 0.96401685), (3, 0.0033902621), (4, 0.005107045), (5, 0.0039868797), (6, 0.003726698), (7, 0.004732535), (8, 0.0046240673), (9, 0.003781818)]","[(2, 0.96401685), (4, 0.005107045), (7, 0.004732535), (8, 0.0046240673), (5, 0.0039868797), (9, 0.003781818), (6, 0.003726698), (3, 0.0033902621), (0, 0.0033228423), (1, 0.0033110676)]",2
85, Q: How many Presidents does it take to screw in a light bulb?   A:  It depends upon your definition of screwing a light bulb . ,president take screw bulb depends definition screwing light bulb,"[(0, 0.0029669534), (1, 0.96699995), (2, 0.0038271686), (3, 0.0030271523), (4, 0.0045600617), (5, 0.00355987), (6, 0.0033275548), (7, 0.004225663), (8, 0.0041288123), (9, 0.0033767712)]","[(1, 0.96699995), (4, 0.0045600617), (7, 0.004225663), (8, 0.0041288123), (2, 0.0038271686), (5, 0.00355987), (9, 0.0033767712), (6, 0.0033275548), (3, 0.0030271523), (0, 0.0029669534)]",1
86," A neutron walks into a bar and orders a drink. ""How much do I owe you?"" the neutron asks.   The bartender replies,  ""for you, no charge.""  ",neutron walk bar order drink owe neutron asks reply charge,"[(0, 0.0026799943), (1, 0.0026704976), (2, 0.0034570107), (3, 0.21193953), (4, 0.0041190195), (5, 0.0032155649), (6, 0.0030057188), (7, 0.0038169634), (8, 0.76204556), (9, 0.0030501753)]","[(8, 0.76204556), (3, 0.21193953), (4, 0.0041190195), (7, 0.0038169634), (2, 0.0034570107), (5, 0.0032155649), (9, 0.0030501753), (6, 0.0030057188), (0, 0.0026799943), (1, 0.0026704976)]",8
87," A man, recently completing a routine physical examination receives a phone call from his doctor.  The doctor says, ""I have some good news and some bad news.""  The man says, ""OK, give me the good news first.""  The doctor says, ""The good news is, you have 24 hours to live.""  The man replies, ""Shit!  That's the good news?  Then what's the bad news?""   The doctor says, ""The bad news is, I forgot to call you  yesterday ."" ",man completing examination receives phone call doctor doctor say news news man say give news doctor say news hour man reply shit news news doctor say news forgot call yesterday,"[(0, 0.0009130641), (1, 0.00090982864), (2, 0.0011777907), (3, 0.00093159004), (4, 0.9903379), (5, 0.001095531), (6, 0.0010240373), (7, 0.0013004253), (8, 0.00127062), (9, 0.0010391833)]","[(4, 0.9903379), (7, 0.0013004253), (8, 0.00127062), (2, 0.0011777907), (5, 0.001095531), (9, 0.0010391833), (6, 0.0010240373), (3, 0.00093159004), (0, 0.0009130641), (1, 0.00090982864)]",4
88," A Czechoslovakian man felt his eyesight was growing steadily worse, and  felt it was time to go see an optometrist.    The doctor started with some simple testing, and showed him a standard eye  chart with letters of diminishing size: CRKBNWXSKZY. . .    ""Can you read this?"" the doctor asked.    ""Read it?"" the Czech answered.  ""Doc, I know him!""  ",man felt growing felt time go doctor started testing showed eye chart letter diminishing size crkbnwxskzy read doctor asked czech answered doc know,"[(0, 0.0011870048), (1, 0.0011827986), (2, 0.0015311557), (3, 0.001211089), (4, 0.0018243681), (5, 0.0014242161), (6, 0.0013312725), (7, 0.0016905835), (8, 0.98726654), (9, 0.0013509628)]","[(8, 0.98726654), (4, 0.0018243681), (7, 0.0016905835), (2, 0.0015311557), (5, 0.0014242161), (9, 0.0013509628), (6, 0.0013312725), (3, 0.001211089), (0, 0.0011870048), (1, 0.0011827986)]",8
89,"  A radio conversation of a US naval  ship with Canadian authorities ...     Americans: Please divert your course 15 degrees to the North to avoid a collision.   Canadians: Recommend you divert YOUR course 15 degrees to the South to  avoid a collision.   Americans: This is the Captain of a US Navy ship.  I say again, divert  YOUR course.   Canadians: No.  I say again, you divert YOUR course.   Americans: This is the aircraft carrier USS LINCOLN, the second largest ship in the United States' Atlantic Fleet. We are accompanied by three destroyers, three cruisers and numerous support vessels. I demand that you change your course 15 degrees north, that's ONE FIVE DEGREES NORTH, or counter-measures will be undertaken to ensure the safety of this ship.   Canadians:  This is a lighthouse.  Your call . ",radio conversation ship authority please course collision recommend divert course degree south collision captain ship say course say course aircraft carrier lincoln ship state fleet accompanied destroyer cruiser support demand change course north counter measure ensure safety ship lighthouse call,"[(0, 0.00068671315), (1, 0.0006842798), (2, 0.0008858133), (3, 0.00070064643), (4, 0.9927332), (5, 0.00082394603), (6, 0.0007701758), (7, 0.0009780464), (8, 0.00095563), (9, 0.00078156707)]","[(4, 0.9927332), (7, 0.0009780464), (8, 0.00095563), (2, 0.0008858133), (5, 0.00082394603), (9, 0.00078156707), (6, 0.0007701758), (3, 0.00070064643), (0, 0.00068671315), (1, 0.0006842798)]",4
90, Q: How many programmers does it take to change a lightbulb?   A:  NONE!   That's a hardware problem....  ,programmer take change lightbulb none hardware problem,"[(0, 0.0037759272), (1, 0.0037625472), (2, 0.00487069), (3, 0.0038525402), (4, 0.0058034146), (5, 0.0045305095), (6, 0.0042348504), (7, 0.0053778384), (8, 0.00525458), (9, 0.95853704)]","[(9, 0.95853704), (4, 0.0058034146), (7, 0.0053778384), (8, 0.00525458), (2, 0.00487069), (5, 0.0045305095), (6, 0.0042348504), (3, 0.0038525402), (0, 0.0037759272), (1, 0.0037625472)]",9
