joke_id,joke,Processed_joke,cluster,sorted_topics,main_topic
91," A Panda bear walks into a bar.  Sits down at a table and orders a beer  and a double cheeseburger.  After he is finished eating, he pulls out a gun and rips the place with gunfire.  Patrons scatter and dive under chairs and tables as the bear runs out the door.  After ensuring that no one is hurt,  the bartender races out the door, and calls after the bear ""What the hell did you do that for?""  The bear calls back, ""I'm a Panda bear.  Look it up in the dictionary.""     The bartender returns, pulls out his dictionary.   panda : \Pan""da\, n. (Zo[""o]l.)  A small Asiatic mammal (Ailurus fulgens) having fine soft fur. It is related to the bears, and inhabits the mountains of Northern India.  Eats shoots and leaves.  ",panda bear walk bar sits order beer cheeseburger finished eating pull gun place gunfire patron scatter chair run door ensuring hurt bartender race door call bear hell call panda look bartender return pull panda pan da zo ailurus fulgens fur related inhabits mountain india eats shoot leaf,"[(0, 0.0005851557), (1, 0.00058308215), (2, 0.0007548111), (3, 0.00059702835), (4, 0.0008993555), (5, 0.0007020933), (6, 0.0006562751), (7, 0.00083340396), (8, 0.0008143026), (9, 0.9935745)]","[(9, 0.9935745), (4, 0.0008993555), (7, 0.00083340396), (8, 0.0008143026), (2, 0.0007548111), (5, 0.0007020933), (6, 0.0006562751), (3, 0.00059702835), (0, 0.0005851557), (1, 0.00058308215)]",9
92," Early one morning a mother went to her sleeping son and woke him up.   ""Wake up, son.  It's time to go to school.""   ""But why, Mama?  I don't want to go to school.""   ""Give me two reasons why you don't want to go to school.""   ""One, all the children hate me. Two, all the teachers hate me,""   ""Oh! that's no reason. Come on, you have to go to school,""     ""Give me two good reasons WHY I should go to school?""     ""One, you are  fifty-two  years old. Two, you are the  principal  of the  school.""  ",morning mother went sleeping son woke wake son time go school mama want go school give reason want go school child hate teacher hate reason come go school reason go school fifty year school,"[(0, 0.0008066994), (1, 0.0008038408), (2, 0.0010405874), (3, 0.00082306715), (4, 0.0012398573), (5, 0.9911915), (6, 0.000904745), (7, 0.001148936), (8, 0.0011226028), (9, 0.0009181267)]","[(5, 0.9911915), (4, 0.0012398573), (7, 0.001148936), (8, 0.0011226028), (2, 0.0010405874), (9, 0.0009181267), (6, 0.000904745), (3, 0.00082306715), (0, 0.0008066994), (1, 0.0008038408)]",5
93," Reaching the end of a job interview, the human resources person asked a young engineer fresh out of Stanford,   ""And what starting salary were you looking for?""   The engineer said, ""In the neighborhood of $125,000 a year, depending on the benefits package.""   The interviewer said, ""Well, what would you say to a package of 5-weeks  vacation, 14 paid holidays, full medical and dental, company matching  retirement fund to 50% of salary, and a company car leased every 2 years -  say, a red Corvette?""   The Engineer sat up straight and said, ""Wow! Are you  kidding ?""   And the interviewer replied,  ""Yeah, but you started it.""  ",reaching end job interview resource person asked engineer stanford starting looking engineer said year depending package interviewer said would say package week vacation paid holiday company matching retirement fund company car leased year say corvette engineer sat said kidding interviewer replied yeah started,"[(0, 0.0006391636), (1, 0.0006368987), (2, 0.9930784), (3, 0.0006521321), (4, 0.000982363), (5, 0.00076689414), (6, 0.000716847), (7, 0.00091032434), (8, 0.00088946), (9, 0.0007274496)]","[(2, 0.9930784), (4, 0.000982363), (7, 0.00091032434), (8, 0.00088946), (5, 0.00076689414), (9, 0.0007274496), (6, 0.000716847), (3, 0.0006521321), (0, 0.0006391636), (1, 0.0006368987)]",2
94," Two atoms are walking down the street when one  atom says to the other  ""Oh, my! I've lost an electron!""   The second atom says""Are you sure""   The first replies  ""I'm positive!""  ",walking street atom say ve lost atom say reply,"[(0, 0.0029669872), (1, 0.0029564735), (2, 0.003827212), (3, 0.0030271867), (4, 0.96860325), (5, 0.0035599105), (6, 0.0033275925), (7, 0.004225711), (8, 0.004128859), (9, 0.0033768096)]","[(4, 0.96860325), (7, 0.004225711), (8, 0.004128859), (2, 0.003827212), (5, 0.0035599105), (9, 0.0033768096), (6, 0.0033275925), (3, 0.0030271867), (0, 0.0029669872), (1, 0.0029564735)]",4
95," Just a thought ..   Before criticizing someone, walk a mile in their shoes.     Then when you do criticize them,   you will be a mile away and have their shoes !  ",thought criticizing someone walk shoe criticize mile shoe,"[(0, 0.0033229836), (1, 0.0033112087), (2, 0.0042864233), (3, 0.0033904065), (4, 0.0051072626), (5, 0.003987049), (6, 0.0037268568), (7, 0.9644615), (8, 0.004624264), (9, 0.003781979)]","[(7, 0.9644615), (4, 0.0051072626), (8, 0.004624264), (2, 0.0042864233), (5, 0.003987049), (9, 0.003781979), (6, 0.0037268568), (3, 0.0033904065), (0, 0.0033229836), (1, 0.0033112087)]",7
96," Two attorneys went into a diner and ordered two drinks.  Then they produced  sandwiches from their briefcases and started to eat.  The owner became quite concerned and marched over and told them,  ""You can't eat your own sandwiches in here!""    The attorneys looked at each other, shrugged their shoulders and then  exchanged  sandwiches. ",attorney went ordered drink produced briefcase started owner became concerned marched eat attorney looked shoulder exchanged sandwich,"[(0, 0.9822341), (1, 0.0015921404), (2, 0.0020610564), (3, 0.0016302214), (4, 0.0024557435), (5, 0.0019171074), (6, 0.0017919979), (7, 0.002275659), (8, 0.0022235017), (9, 0.0018185027)]","[(0, 0.9822341), (4, 0.0024557435), (7, 0.002275659), (8, 0.0022235017), (2, 0.0020610564), (5, 0.0019171074), (9, 0.0018185027), (6, 0.0017919979), (3, 0.0016302214), (1, 0.0015921404)]",0
97," A teacher is explaining to her class how different languages use  negatives differently.  She says, ""In all languages, a positive followed by a negative or a negative followed by a positive makes a negative.  In some languages, two negatives together make a positive, while in others they make a negative.  But in no language do two positives make a negative.""     One of the students puts up his hand and says,  ""Yeah, right.""  ",explaining class language use say language followed followed make language make others make language make student put hand say,"[(0, 0.0014325128), (1, 0.0014274366), (2, 0.0018478442), (3, 0.0014615782), (4, 0.0022017017), (5, 0.0017187864), (6, 0.0016066193), (7, 0.98467964), (8, 0.0019934848), (9, 0.0016303821)]","[(7, 0.98467964), (4, 0.0022017017), (8, 0.0019934848), (2, 0.0018478442), (5, 0.0017187864), (9, 0.0016303821), (6, 0.0016066193), (3, 0.0014615782), (0, 0.0014325128), (1, 0.0014274366)]",7
98," Age and Womanhood   1. Between the ages of 13 and 18 ...  &nbsp;&nbsp;&nbsp;&nbsp; She is like Africa, virgin and unexplored.     2. Between the ages of 19 and 35 ...  &nbsp;&nbsp;&nbsp;&nbsp; She is like Asia, hot and exotic.     3. Between the ages of 36 and 45 ...  &nbsp;&nbsp;&nbsp;&nbsp; She is like America, fully explored, breathtakingly beautiful,and free with her resources.    4. Between the ages of 46 and 56 ...  &nbsp;&nbsp;&nbsp;&nbsp; She is like Europe, exhausted but still has points of interest.     5. After 56 she is like Australia ...  &nbsp;&nbsp;&nbsp;&nbsp; Everybody knows it's down there, but who gives a damn?  ",age womanhood age nbsp africa virgin unexplored age nbsp asia age nbsp america explored resource age nbsp europe exhausted point interest australia nbsp everybody know damn,"[(0, 0.9883056), (1, 0.0010480266), (2, 0.0013566907), (3, 0.0010730934), (4, 0.0016164934), (5, 0.0012619362), (6, 0.0011795829), (7, 0.0014979527), (8, 0.0014636202), (9, 0.0011970296)]","[(0, 0.9883056), (4, 0.0016164934), (7, 0.0014979527), (8, 0.0014636202), (2, 0.0013566907), (5, 0.0012619362), (9, 0.0011970296), (6, 0.0011795829), (3, 0.0010730934), (1, 0.0010480266)]",0
99, A bus station is where a bus stops.  A train station is where a train stops.   On  my  desk I have a  work station...  ,bus station bus stop train station train stop desk work station,"[(0, 0.0024434542), (1, 0.9728226), (2, 0.00315189), (3, 0.0024930313), (4, 0.0037554689), (5, 0.0029317546), (6, 0.0027404297), (7, 0.0034800728), (8, 0.0034003106), (9, 0.0027809623)]","[(1, 0.9728226), (4, 0.0037554689), (7, 0.0034800728), (8, 0.0034003106), (2, 0.00315189), (5, 0.0029317546), (9, 0.0027809623), (6, 0.0027404297), (3, 0.0024930313), (0, 0.0024434542)]",1
100, Q: Whats the difference between greeting a Queen and greeting the President of the United  States?   A: You only have to get on  one knee  to greet the queen. ,whats difference greeting greeting president united state get knee greet queen,"[(0, 0.0024434847), (1, 0.97282225), (2, 0.0031519295), (3, 0.0024930628), (4, 0.0037555161), (5, 0.0029317914), (6, 0.0027404642), (7, 0.0034801164), (8, 0.0034003535), (9, 0.0027809972)]","[(1, 0.97282225), (4, 0.0037555161), (7, 0.0034801164), (8, 0.0034003535), (2, 0.0031519295), (5, 0.0029317914), (9, 0.0027809972), (6, 0.0027404642), (3, 0.0024930628), (0, 0.0024434847)]",1
